
Showing logs for build [32mentando-k8s-entando-k8s-keycloa-9sjbq-1[0m stage [32mfrom-build-pack[0m and container [32mstep-credential-initializer-6698v[0m
{"level":"warn","ts":1613662373.6572368,"logger":"fallback-logger","caller":"logging/config.go:69","msg":"Fetch GitHub commit ID from kodata failed: \"ref: refs/heads/0.8.0-**-support-backwards-incompats\" is not a valid GitHub commit ID"}
{"level":"info","ts":1613662373.6649272,"logger":"fallback-logger","caller":"creds-init/main.go:40","msg":"Credentials initialized."}

Showing logs for build [32mentando-k8s-entando-k8s-keycloa-9sjbq-1[0m stage [32mfrom-build-pack[0m and container [32mstep-working-dir-initializer-4bmh5[0m
{"level":"warn","ts":1613662377.0546112,"logger":"fallback-logger","caller":"logging/config.go:69","msg":"Fetch GitHub commit ID from kodata failed: open /var/run/ko/HEAD: no such file or directory"}
{"level":"info","ts":1613662377.770584,"logger":"fallback-logger","caller":"bash/main.go:64","msg":"Successfully e**cuted command \"sh -c mkdir -p /workspace/source\"; output "}

Showing logs for build [32mentando-k8s-entando-k8s-keycloa-9sjbq-1[0m stage [32mfrom-build-pack[0m and container [32mstep-place-tools[0m

Showing logs for build [32mentando-k8s-entando-k8s-keycloa-9sjbq-1[0m stage [32mfrom-build-pack[0m and container [32mstep-git-source-entando-k8s-entando-k8s-keycloa-rsr6h[0m
{"level":"warn","ts":1613662496.9832726,"logger":"fallback-logger","caller":"logging/config.go:69","msg":"Fetch GitHub commit ID from kodata failed: \"ref: refs/heads/0.8.0-**-support-backwards-incompats\" is not a valid GitHub commit ID"}
{"level":"info","ts":1613662498.3696315,"logger":"fallback-logger","caller":"git/git.go:103","msg":"Successfully cloned https://github.com/entando-k8s/entando-k8s-keycloak-controller.git @ master in path /workspace/source"}

Showing logs for build [32mentando-k8s-entando-k8s-keycloa-9sjbq-1[0m stage [32mfrom-build-pack[0m and container [32mstep-git-merge[0m
Using SHAs from PULL_REFS=master:f276bb9bf71faec9c5cf11dc6dc37b34169dba27,22:1b433ad0b699622c98c5896c8c6be6313a37b60d
DEBUG: ran git fetch --unshallow origin 1b433ad0b699622c98c5896c8c6be6313a37b60d: f276bb9bf71faec9c5cf11dc6dc37b34169dba27: in 
DEBUG: ran git checkout master in 
DEBUG: ran git reset --hard f276bb9bf71faec9c5cf11dc6dc37b34169dba27 in 
DEBUG: ran clean --force -d . in 
DEBUG: ran git merge 1b433ad0b699622c98c5896c8c6be6313a37b60d in 
Merged SHA 1b433ad0b699622c98c5896c8c6be6313a37b60d with commit message 'ENG-1829 bumped to latest operator-common' into base branch master

Showing logs for build [32mentando-k8s-entando-k8s-keycloa-9sjbq-1[0m stage [32mfrom-build-pack[0m and container [32mstep-build-set-version[0m
Picked up _JAVA_OPTIONS: -XX:+UnlockExperimentalVMOptions -Dsun.zip.disableMemoryMapping=**** -XX:+UseParallelGC -XX:MinHeapFreeRatio=5 -XX:MaxHeapFreeRatio=10 -XX:GCTimeRatio=4 -XX:AdaptiveSizePolicyWeight=90 -Xms1000m -Xmx12000m
[INFO] Scanning for projects...
[INFO] 
[INFO] ------------< org.entando:entando-k8s-keycloak-controller >-------------
[INFO] Building Entando K8S Controller for Keycloak 6.3.0-SNAPSHOT
[INFO] --------------------------------[ jar ]---------------------------------
[INFO] 
[INFO] --- versions-maven-plugin:2.8.1:set (default-cli) @ entando-k8s-keycloak-controller ---
[INFO] Local aggregation ****: /workspace/source
[INFO] Processing change of org.entando:entando-k8s-keycloak-controller:6.3.0-SNAPSHOT -> 0.0.0-SNAPSHOT-PR-22-1
[INFO] Processing org.entando:entando-k8s-keycloak-controller
[INFO]     Updating project org.entando:entando-k8s-keycloak-controller
[INFO]         from version 6.3.0-SNAPSHOT to 0.0.0-SNAPSHOT-PR-22-1
[INFO] 
[INFO] ------------------------------------------------------------------------
[INFO] BUILD SUCCESS
[INFO] ------------------------------------------------------------------------
[INFO] Total time:  10.732 s
[INFO] Finished at: 2021-02-18T15:35:14Z
[INFO] ------------------------------------------------------------------------

Showing logs for build [32mentando-k8s-entando-k8s-keycloa-9sjbq-1[0m stage [32mfrom-build-pack[0m and container [32mstep-build-fix-git-for-sonar[0m
M	pom.xml
Switched to a new branch 'PR-22'
Deleted branch master (was 1b433ad).
From https://github.com/entando-k8s/entando-k8s-keycloak-controller
 * [new branch]      master     -> master
 * [new tag]         v6.0.24    -> v6.0.24
 * [new tag]         v6.0.31    -> v6.0.31

Showing logs for build [32mentando-k8s-entando-k8s-keycloa-9sjbq-1[0m stage [32mfrom-build-pack[0m and container [32mstep-build-mvn-verify-pr[0m
Picked up _JAVA_OPTIONS: -XX:+UnlockExperimentalVMOptions -Dsun.zip.disableMemoryMapping=**** -XX:+UseParallelGC -XX:MinHeapFreeRatio=5 -XX:MaxHeapFreeRatio=10 -XX:GCTimeRatio=4 -XX:AdaptiveSizePolicyWeight=90 -Xms1000m -Xmx12000m
[INFO] Scanning for projects...
[INFO] 
[INFO] ------------< org.entando:entando-k8s-keycloak-controller >-------------
[INFO] Building Entando K8S Controller for Keycloak 0.0.0-SNAPSHOT-PR-22-1
[INFO] --------------------------------[ jar ]---------------------------------
[INFO] 
[INFO] --- maven-checkstyle-plugin:3.1.1:check (validate) @ entando-k8s-keycloak-controller ---
[INFO] Starting audit...
Audit done.
[INFO] You have 0 Checkstyle violations.
[INFO] 
[INFO] --- maven-checkstyle-plugin:3.1.1:checkstyle (validate) @ entando-k8s-keycloak-controller ---
[INFO] Starting audit...
Audit done.
[INFO] 
[INFO] --- jacoco-maven-plugin:0.8.5:prepare-agent (prepare-agent) @ entando-k8s-keycloak-controller ---
[INFO] argLine set to -javaagent:/home/jenkins/.mvnrepository/org/jacoco/org.jacoco.agent/0.8.5/org.jacoco.agent-0.8.5-runtime.jar=destfile=/workspace/source/target/jacoco.e**c
[INFO] 
[INFO] --- maven-resources-plugin:2.6:resources (default-resources) @ entando-k8s-keycloak-controller ---
[INFO] Using 'UTF-8' encoding to copy filtered resources.
[INFO] Copying 4 resources
[INFO] 
[INFO] --- maven-compiler-plugin:3.8.1:compile (default-compile) @ entando-k8s-keycloak-controller ---
[INFO] Changes detected - recompiling the module!
[INFO] Compiling 5 source files to /workspace/source/target/classes
[INFO] 
[INFO] --- maven-resources-plugin:2.6:testResources (default-testResources) @ entando-k8s-keycloak-controller ---
[INFO] Using 'UTF-8' encoding to copy filtered resources.
[INFO] Copying 6 resources
[INFO] 
[INFO] --- maven-compiler-plugin:3.8.1:testCompile (default-testCompile) @ entando-k8s-keycloak-controller ---
[INFO] Changes detected - recompiling the module!
[INFO] Compiling 7 source files to /workspace/source/target/test-classes
[INFO] 
[INFO] --- maven-surefire-plugin:3.0.0-M1:test (default-test) @ entando-k8s-keycloak-controller ---
[INFO] 
[INFO] -------------------------------------------------------
[INFO]  T E S T S
[INFO] -------------------------------------------------------
[INFO] Running org.entando.kubernetes.controller.keycloakserver.inprocesstests.DeployKeycloakOnExternalDatabaseTest
Feb 18, 2021 3:35:44 PM org.entando.kubernetes.controller.keycloakserver.EntandoKeycloakServerController ensureKeycloakRealm
SEVERE: Attempting to log into Keycloak at http://my-keycloak-server-service.my-keycloak-namespace.svc.cluster.local:8080/auth
Feb 18, 2021 3:35:45 PM org.entando.kubernetes.controller.keycloakserver.EntandoKeycloakServerController ensureKeycloakRealm
SEVERE: Attempting to log into Keycloak at http://my-keycloak-server-service.my-keycloak-namespace.svc.cluster.local:8080/auth
[INFO] Tests run: 2, Failures: 0, Errors: 0, Skipped: 0, Time elapsed: 5.42 s - in org.entando.kubernetes.controller.keycloakserver.inprocesstests.DeployKeycloakOnExternalDatabaseTest
[INFO] Running org.entando.kubernetes.controller.keycloakserver.inprocesstests.DeployKeycloakServiceTest
Feb 18, 2021 3:35:47 PM org.entando.kubernetes.controller.keycloakserver.EntandoKeycloakServerController ensureKeycloakRealm
SEVERE: Attempting to log into Keycloak at http://my-keycloak-server-service.my-keycloak-namespace.svc.cluster.local:8080/auth
Feb 18, 2021 3:35:48 PM org.entando.kubernetes.controller.keycloakserver.EntandoKeycloakServerController ensureKeycloakRealm
SEVERE: Attempting to log into Keycloak at http://my-keycloak-server-service.my-keycloak-namespace.svc.cluster.local:8080/auth
Feb 18, 2021 3:35:50 PM org.entando.kubernetes.controller.keycloakserver.EntandoKeycloakServerController ensureKeycloakRealm
SEVERE: Attempting to log into Keycloak at http://my-keycloak-server-service.my-keycloak-namespace.svc.cluster.local:8080/auth
Feb 18, 2021 3:35:51 PM org.entando.kubernetes.controller.keycloakserver.EntandoKeycloakServerController ensureKeycloakRealm
SEVERE: Attempting to log into Keycloak at http://my-keycloak-server-service.my-keycloak-namespace.svc.cluster.local:8080/auth
Feb 18, 2021 3:35:53 PM org.entando.kubernetes.controller.keycloakserver.EntandoKeycloakServerController ensureKeycloakRealm
SEVERE: Attempting to log into Keycloak at http://my-keycloak-server-service.my-keycloak-namespace.svc.cluster.local:8080/auth
Feb 18, 2021 3:35:54 PM org.entando.kubernetes.controller.keycloakserver.EntandoKeycloakServerController ensureKeycloakRealm
SEVERE: Attempting to log into Keycloak at http://my-keycloak-server-service.my-keycloak-namespace.svc.cluster.local:8080/auth
Feb 18, 2021 3:35:56 PM org.entando.kubernetes.controller.keycloakserver.EntandoKeycloakServerController ensureKeycloakRealm
SEVERE: Attempting to log into Keycloak at http://my-keycloak-server-service.my-keycloak-namespace.svc.cluster.local:8080/auth
Feb 18, 2021 3:35:57 PM org.entando.kubernetes.controller.keycloakserver.EntandoKeycloakServerController ensureKeycloakRealm
SEVERE: Attempting to log into Keycloak at http://my-keycloak-server-service.my-keycloak-namespace.svc.cluster.local:8080/auth
[INFO] Tests run: 8, Failures: 0, Errors: 0, Skipped: 0, Time elapsed: 11.816 s - in org.entando.kubernetes.controller.keycloakserver.inprocesstests.DeployKeycloakServiceTest
[INFO] Running org.entando.kubernetes.controller.keycloakserver.inprocesstests.DeployKeycloakWithContainerizedDatabaseTest
Feb 18, 2021 3:35:58 PM org.entando.kubernetes.controller.keycloakserver.EntandoKeycloakServerController ensureKeycloakRealm
SEVERE: Attempting to log into Keycloak at http://my-keycloak-server-service.my-keycloak-namespace.svc.cluster.local:8080/auth
Feb 18, 2021 3:35:59 PM org.entando.kubernetes.controller.keycloakserver.EntandoKeycloakServerController ensureKeycloakRealm
SEVERE: Attempting to log into Keycloak at http://my-keycloak-server-service.my-keycloak-namespace.svc.cluster.local:8080/auth
[INFO] Tests run: 2, Failures: 0, Errors: 0, Skipped: 0, Time elapsed: 1.846 s - in org.entando.kubernetes.controller.keycloakserver.inprocesstests.DeployKeycloakWithContainerizedDatabaseTest
[INFO] 
[INFO] Results:
[INFO] 
[INFO] Tests run: 12, Failures: 0, Errors: 0, Skipped: 0
[INFO] 
[INFO] 
[INFO] --- maven-jar-plugin:3.2.0:jar (default-jar) @ entando-k8s-keycloak-controller ---
[INFO] Building jar: /workspace/source/target/entando-k8s-keycloak-controller-0.0.0-SNAPSHOT-PR-22-1.jar
[INFO] 
[INFO] --- maven-jar-plugin:3.2.0:test-jar (build-test-jar) @ entando-k8s-keycloak-controller ---
[INFO] Building jar: /workspace/source/target/entando-k8s-keycloak-controller-0.0.0-SNAPSHOT-PR-22-1-tests.jar
[INFO] 
[INFO] --- maven-javadoc-plugin:3.2.0:jar (attach-javadocs) @ entando-k8s-keycloak-controller ---
[INFO] No previous run data found, generating javadoc.
[INFO] Building jar: /workspace/source/target/entando-k8s-keycloak-controller-0.0.0-SNAPSHOT-PR-22-1-javadoc.jar
[INFO] 
[INFO] --- license-maven-plugin:2.0.0:aggregate-download-licenses (download-licenses) @ entando-k8s-keycloak-controller ---
[INFO] skip flag is on, will skip goal.
[INFO] 
[INFO] --- quarkus-maven-plugin:1.2.0.Final:build (default) @ entando-k8s-keycloak-controller ---
[WARNING] [io.quarkus.creator.curator.Curator] These dependencies are not recommended:
	- javax.servlet:javax.servlet-api should be replaced by jakarta.servlet:jakarta.servlet-api
You might end up with two different versions of the same classes or with an artifact you shouldn't have in your classpath.
[INFO] [org.jboss.threads] JBoss Threads version 3.0.0.Final
[WARNING] [io.quarkus.deployment.steps.ReflectiveHierarchyStep] Unable to properly register the hierarchy of the following classes for reflection as they are not in the Jandex index:
	- org.entando.kubernetes.model.EntandoCustomResourceStatus
Consider adding them to the index either by creating a Jandex index for your dependency via the Maven plugin, an empty META-INF/beans.xml or quarkus.index-dependency properties.");.
[INFO] [io.quarkus.deployment.pkg.steps.JarResultBuildStep] Building thin jar: /workspace/source/target/entando-k8s-keycloak-controller-0.0.0-SNAPSHOT-PR-22-1-runner.jar
[INFO] [io.quarkus.deployment.QuarkusAugmentor] Quarkus augmentation completed in 1984ms
[INFO] 
[INFO] --- maven-surefire-report-plugin:3.0.0-M4:failsafe-report-only (integration-tests) @ entando-k8s-keycloak-controller ---
[INFO] 
[INFO] --- dependency-check-maven:6.0.3:aggregate (default) @ entando-k8s-keycloak-controller ---
[INFO] Checking for updates
[INFO] Skipping NVD check since last check was within 4 hours.
[INFO] Check for updates complete (53 ms)
[INFO] 

Dependency-Check is an open source tool performing a best effort analysis of 3rd party dependencies; false positives and false negatives may exist in the analysis performed by the tool. Use of the tool and the reporting provided constitutes acceptance for use in an AS IS condition, and there are NO warranties, implied or otherwise, with regard to the analysis or its use. Any use of the tool and the reporting provided is at the user’s risk. In no event shall the copyright holder or OWASP be held liable for any damages whatsoever arising out of or in connection with the use of this tool, the analysis performed, or the resulting report.


[INFO] Analysis Started
[INFO] Finished Archive Analyzer (0 seconds)
[INFO] Finished File Name Analyzer (0 seconds)
[INFO] Finished Jar Analyzer (0 seconds)
[INFO] Finished Dependency Merging Analyzer (0 seconds)
[INFO] Finished Version Filter Analyzer (0 seconds)
[INFO] Finished Hint Analyzer (0 seconds)
[INFO] Created CPE Index (2 seconds)
[INFO] Finished CPE Analyzer (3 seconds)
[INFO] Finished False Positive Analyzer (0 seconds)
[INFO] Finished NVD CVE Analyzer (0 seconds)
[INFO] Finished Sonatype OSS Index Analyzer (1 seconds)
[INFO] Finished Vulnerability Suppression Analyzer (0 seconds)
[INFO] Finished Dependency Bundling Analyzer (0 seconds)
[INFO] Analysis Complete (8 seconds)
[INFO] 
[INFO] --- jacoco-maven-plugin:0.8.5:report (report) @ entando-k8s-keycloak-controller ---
[INFO] Loading e**cution data file /workspace/source/target/jacoco.e**c
[INFO] Analyzed bundle 'Entando K8S Controller for Keycloak' with 5 classes
[INFO] 
[INFO] --- maven-surefire-report-plugin:3.0.0-M4:report-only (unit-tests) @ entando-k8s-keycloak-controller ---
[WARNING] Unable to locate Test Source XRef to link to - DISABLED
[INFO] 
[INFO] --- maven-install-plugin:2.4:install (default-install) @ entando-k8s-keycloak-controller ---
[INFO] Installing /workspace/source/target/entando-k8s-keycloak-controller-0.0.0-SNAPSHOT-PR-22-1.jar to /home/jenkins/.mvnrepository/org/entando/entando-k8s-keycloak-controller/0.0.0-SNAPSHOT-PR-22-1/entando-k8s-keycloak-controller-0.0.0-SNAPSHOT-PR-22-1.jar
[INFO] Installing /workspace/source/pom.xml to /home/jenkins/.mvnrepository/org/entando/entando-k8s-keycloak-controller/0.0.0-SNAPSHOT-PR-22-1/entando-k8s-keycloak-controller-0.0.0-SNAPSHOT-PR-22-1.pom
[INFO] Installing /workspace/source/target/entando-k8s-keycloak-controller-0.0.0-SNAPSHOT-PR-22-1-tests.jar to /home/jenkins/.mvnrepository/org/entando/entando-k8s-keycloak-controller/0.0.0-SNAPSHOT-PR-22-1/entando-k8s-keycloak-controller-0.0.0-SNAPSHOT-PR-22-1-tests.jar
[INFO] Installing /workspace/source/target/entando-k8s-keycloak-controller-0.0.0-SNAPSHOT-PR-22-1-javadoc.jar to /home/jenkins/.mvnrepository/org/entando/entando-k8s-keycloak-controller/0.0.0-SNAPSHOT-PR-22-1/entando-k8s-keycloak-controller-0.0.0-SNAPSHOT-PR-22-1-javadoc.jar
[INFO] 
[INFO] --- maven-deploy-plugin:2.8.2:deploy (default-deploy) @ entando-k8s-keycloak-controller ---
[INFO] Using alternate deployment repository local-nexus::default::http://nexus/repository/maven-releases/
[INFO] 
[INFO] ------------< org.entando:entando-k8s-keycloak-controller >-------------
[INFO] Building Entando K8S Controller for Keycloak 0.0.0-SNAPSHOT-PR-22-1
[INFO] --------------------------------[ jar ]---------------------------------
[INFO] 
[INFO] --- sonar-maven-plugin:3.8.0.2131:sonar (default-cli) @ entando-k8s-keycloak-controller ---
[INFO] User cache: /****/.sonar/cache
[INFO] SonarQube version: 8.5.0
[INFO] Default locale: "en_US", source code encoding: "UTF-8"
[INFO] Load global settings
[INFO] Load global settings (done) | time=225ms
[INFO] Server id: 1BD809FA-AWHW8ct9-T_TB3XqouNu
[INFO] User cache: /****/.sonar/cache
[INFO] Load/download plugins
[INFO] Load plugins index
[INFO] Load plugins index (done) | time=89ms
[INFO] Load/download plugins (done) | time=22156ms
[INFO] Loaded core extensions: developer-scanner
[INFO] JavaScript/TypeScript frontend is enabled
[INFO] Load project settings for component key: 'entando-k8s_entando-k8s-keycloak-controller'
[INFO] Load project settings for component key: 'entando-k8s_entando-k8s-keycloak-controller' (done) | time=39ms
[INFO] Process project properties
[INFO] E**cute project builders
[INFO] E**cute project builders (done) | time=1ms
[INFO] Project key: entando-k8s_entando-k8s-keycloak-controller
[INFO] Base dir: /workspace/source
[INFO] Working dir: /workspace/source/target/sonar
[INFO] Load project branches
[INFO] Load project branches (done) | time=27ms
[INFO] Check ALM binding of project 'entando-k8s_entando-k8s-keycloak-controller'
[INFO] Detected project binding: BOUND
[INFO] Check ALM binding of project 'entando-k8s_entando-k8s-keycloak-controller' (done) | time=59ms
[INFO] Load project pull requests
[INFO] Load project pull requests (done) | time=36ms
[INFO] Load branch configuration
[INFO] Load branch configuration (done) | time=492ms
[INFO] Load quality profiles
[INFO] Load quality profiles (done) | time=66ms
[INFO] Load active rules
[INFO] Load active rules (done) | time=1428ms
[INFO] Organization key: entando-k8s
[INFO] Pull request 22 for merge into master from ENG-1829
[INFO] SCM collecting changed files in the branch
[WARNING] Exception caught during e**cution of command '[/usr/local/git/bin/git, config, --******, --edit]' in '/usr/local/git/bin', return code '128', error message 'fatal: Invalid path '/usr/local/git/etc': No such file or directory
'
[INFO] SCM collecting changed files in the branch (done) | time=316ms
[INFO] Indexing files...
[INFO] Project configuration:
[INFO] 13 files inde**d
[INFO] 0 files ignored because of scm ignore settings
[INFO] Quality profile for java: Sonar way
[INFO] Quality profile for xml: Sonar way
[INFO] ------------- Run sensors on module Entando K8S Controller for Keycloak
[INFO] JavaScript/TypeScript frontend is enabled
[INFO] Load metrics repository
[INFO] Load metrics repository (done) | time=25ms
[INFO] Sensor JavaSquidSensor [java]
[INFO] Configured Java source version (sonar.java.source): 8
[INFO] JavaClasspath initialization
[INFO] JavaClasspath initialization (done) | time=24ms
[INFO] JavaTestClasspath initialization
[INFO] JavaTestClasspath initialization (done) | time=2ms
[INFO] Java Main Files AST scan
[INFO] 5 source files to be analyzed
[INFO] 5/5 source files have been analyzed
[INFO] Java Main Files AST scan (done) | time=3726ms
[INFO] Java Test Files AST scan
[INFO] 7 source files to be analyzed
[INFO] Java Test Files AST scan (done) | time=1347ms
[INFO] Java Generated Files AST scan
[INFO] 0 source files to be analyzed
[INFO] 7/7 source files have been analyzed
[INFO] Java Generated Files AST scan (done) | time=9ms
[INFO] Sensor JavaSquidSensor [java] (done) | time=5532ms
[INFO] Sensor SonarCSS Rules [cssfamily]
[INFO] No CSS, PHP, HTML or VueJS files are found in the project. CSS analysis is skipped.
[INFO] Sensor SonarCSS Rules [cssfamily] (done) | time=2ms
[INFO] Sensor C# Properties [csharp]
[INFO] Sensor C# Properties [csharp] (done) | time=1ms
[INFO] Sensor Import of Checkstyle issues [java]
[INFO] Importing /workspace/source/target/checkstyle-result.xml
[INFO] 0/0 source files have been analyzed
[INFO] Sensor Import of Checkstyle issues [java] (done) | time=98ms
[INFO] Sensor SurefireSensor [java]
[INFO] parsing [/workspace/source/target/surefire-reports]
[INFO] Sensor SurefireSensor [java] (done) | time=56ms
[INFO] Sensor JavaXmlSensor [java]
[INFO] 1 source files to be analyzed
[INFO] Sensor JavaXmlSensor [java] (done) | time=305ms
[INFO] 1/1 source files have been analyzed
[INFO] Sensor HTML [web]
[INFO] Sensor HTML [web] (done) | time=4ms
[INFO] Sensor XML Sensor [xml]
[INFO] 1 source file to be analyzed
[INFO] 1/1 source file has been analyzed
[INFO] Sensor XML Sensor [xml] (done) | time=592ms
[INFO] Sensor VB.NET Properties [vbnet]
[INFO] Sensor VB.NET Properties [vbnet] (done) | time=1ms
[INFO] Sensor JaCoCo XML Report Importer [jacoco]
[INFO] Importing 1 report(s). Turn your logs in debug mode in order to see the exhaustive list.
[INFO] Sensor JaCoCo XML Report Importer [jacoco] (done) | time=29ms
[INFO] Sensor ThymeLeaf template sensor [securityjavafrontend]
[INFO] Sensor ThymeLeaf template sensor [securityjavafrontend] (done) | time=2ms
[INFO] Sensor JavaSecuritySensor [security]
[INFO] Reading type hierarchy from: /workspace/source/target/sonar/ucfg2/java
[INFO] Read 102 type definitions
[INFO] Reading UCFGs from: /workspace/source/target/sonar/ucfg2/java
[INFO] 15:37:03.486322 Building Runtime Type propagation graph
[INFO] 15:37:03.50346 Running Tarjan on 192 nodes
[INFO] 15:37:03.506119 Tarjan found 192 components
[INFO] 15:37:03.509374 Variable type analysis: done
[INFO] 15:37:03.560719 Building Runtime Type propagation graph
[INFO] 15:37:03.568*** Running Tarjan on 192 nodes
[INFO] 15:37:03.56954 Tarjan found 192 components
[INFO] 15:37:03.570507 Variable type analysis: done
[INFO] Analyzing 45 ucfgs to detect vulnerabilities.
[INFO] All rules entrypoints : 0 Retained UCFGs : 0
[INFO] rule: S5131, entrypoints: 0
[INFO] rule: S5131 done
[INFO] rule: S3649, entrypoints: 0
[INFO] rule: S3649 done
[INFO] rule: S2076, entrypoints: 0
[INFO] rule: S2076 done
[INFO] rule: S2091, entrypoints: 0
[INFO] rule: S2091 done
[INFO] rule: S2078, entrypoints: 0
[INFO] rule: S2078 done
[INFO] rule: S2631, entrypoints: 0
[INFO] rule: S2631 done
[INFO] rule: S5135, entrypoints: 0
[INFO] rule: S5135 done
[INFO] rule: S2083, entrypoints: 0
[INFO] rule: S2083 done
[INFO] rule: S5167, entrypoints: 0
[INFO] rule: S5167 done
[INFO] rule: S5144, entrypoints: 0
[INFO] rule: S5144 done
[INFO] rule: S5145, entrypoints: 0
[INFO] rule: S5145 done
[INFO] rule: S5146, entrypoints: 0
[INFO] rule: S5146 done
[INFO] rule: S5334, entrypoints: 0
[INFO] rule: S5334 done
[INFO] rule: S6096, entrypoints: 0
[INFO] rule: S6096 done
[INFO] Sensor JavaSecuritySensor [security] (done) | time=705ms
[INFO] Sensor CSharpSecuritySensor [security]
[INFO] Reading type hierarchy from: /workspace/source/target/ucfg_cs2
[INFO] Read 0 type definitions
[INFO] Reading UCFGs from: /workspace/source/target/ucfg_cs2
[INFO] No UCFGs have been included for analysis.
[INFO] Sensor CSharpSecuritySensor [security] (done) | time=1ms
[INFO] Sensor PhpSecuritySensor [security]
[INFO] Reading type hierarchy from: /workspace/source/target/sonar/ucfg2/php
[INFO] Read 0 type definitions
[INFO] Reading UCFGs from: /workspace/source/target/sonar/ucfg2/php
[INFO] No UCFGs have been included for analysis.
[INFO] Sensor PhpSecuritySensor [security] (done) | time=1ms
[INFO] Sensor PythonSecuritySensor [security]
[INFO] Reading type hierarchy from: /workspace/source/target/sonar/ucfg2/python
[INFO] Read 0 type definitions
[INFO] Reading UCFGs from: /workspace/source/target/sonar/ucfg2/python
[INFO] No UCFGs have been included for analysis.
[INFO] Sensor PythonSecuritySensor [security] (done) | time=1ms
[INFO] Sensor JsSecuritySensor [security]
[INFO] Reading type hierarchy from: /workspace/source/target/sonar/ucfg2/js
[INFO] Read 0 type definitions
[INFO] Reading UCFGs from: /workspace/source/target/sonar/ucfg2/js
[INFO] No UCFGs have been included for analysis.
[INFO] Sensor JsSecuritySensor [security] (done) | time=1ms
[INFO] ------------- Run sensors on project
[INFO] Sensor Zero Coverage Sensor
[INFO] Sensor Zero Coverage Sensor (done) | time=0ms
[INFO] Sensor Java CPD Block Inde**r
[INFO] Sensor Java CPD Block Inde**r (done) | time=47ms
[INFO] SCM Publisher SCM provider for this project is: git
[INFO] SCM Publisher 10 source files to be analyzed
[INFO] SCM Publisher 9/10 source files have been analyzed (done) | time=432ms
[WARNING] Missing blame information for the following files:
[WARNING]   * pom.xml
[WARNING] This may lead to missing/broken features in SonarCloud
[INFO] CPD E**cutor 1 file had no CPD blocks
[INFO] CPD E**cutor Calculating CPD for 4 files
[INFO] CPD E**cutor CPD calculation finished (done) | time=16ms
[INFO] SCM writing changed lines
[INFO] SCM writing changed lines (done) | time=226ms
[INFO] Analysis report generated in 443ms, dir size=339 KB
[INFO] Analysis report compressed in 56ms, zip size=95 KB
[INFO] Analysis report uploaded in 140ms
[INFO] ANALYSIS SUCCESSFUL, you can find the results at: https://sonarcloud.io/dashboard?id=entando-k8s_entando-k8s-keycloak-controller&pullRequest=22
[INFO] Note that you will be able to access the updated dashboard once the server has processed the submitted analysis report
[INFO] More about the report processing at https://sonarcloud.io/api/ce/task?id=AXe1yZ0lrLQ7UuL1WVOR
[INFO] Analysis total time: 14.249 s
[INFO] ------------------------------------------------------------------------
[INFO] BUILD SUCCESS
[INFO] ------------------------------------------------------------------------
[INFO] Total time:  01:43 min
[INFO] Finished at: 2021-02-18T15:37:05Z
[INFO] ------------------------------------------------------------------------
Picked up _JAVA_OPTIONS: -XX:+UnlockExperimentalVMOptions -Dsun.zip.disableMemoryMapping=**** -XX:+UseParallelGC -XX:MinHeapFreeRatio=5 -XX:MaxHeapFreeRatio=10 -XX:GCTimeRatio=4 -XX:AdaptiveSizePolicyWeight=90 -Xms1000m -Xmx12000m
[INFO] Scanning for projects...
[INFO] 
[INFO] ------------< org.entando:entando-k8s-keycloak-controller >-------------
[INFO] Building Entando K8S Controller for Keycloak 0.0.0-SNAPSHOT-PR-22-1
[INFO] --------------------------------[ jar ]---------------------------------
[INFO] 
[INFO] --- maven-site-plugin:3.9.0:site (default-site) @ entando-k8s-keycloak-controller ---
[INFO] configuring report plugin org.apache.maven.plugins:maven-project-info-reports-plugin:3.0.0
[INFO] 9 reports configured for maven-project-info-reports-plugin:3.0.0: dependency-info, distribution-management, index, ci-management, issue-management, licenses, plugins, scm, summary
[INFO] Rendering site with default locale English (en)
[WARNING] Unable to find a URL to the parent project. The parent menu will NOT be added.
[INFO] Relativizing decoration links with respect to localized project URL: https://central.entando.com
[INFO] Rendering content with org.apache.maven.skins:maven-default-skin:jar:1.3 skin.
[INFO] Generating "Dependency Information" report --- maven-project-info-reports-plugin:3.0.0:dependency-info
[INFO] Generating "About" report         --- maven-project-info-reports-plugin:3.0.0:index
[INFO] Generating "Issue Management" report --- maven-project-info-reports-plugin:3.0.0:issue-management
[INFO] Generating "Licenses" report      --- maven-project-info-reports-plugin:3.0.0:licenses
[INFO] Generating "Plugins" report       --- maven-project-info-reports-plugin:3.0.0:plugins
[INFO] Generating "Source Code Management" report --- maven-project-info-reports-plugin:3.0.0:scm
[INFO] Generating "Summary" report       --- maven-project-info-reports-plugin:3.0.0:summary
[INFO] ------------------------------------------------------------------------
[INFO] BUILD SUCCESS
[INFO] ------------------------------------------------------------------------
[INFO] Total time:  9.782 s
[INFO] Finished at: 2021-02-18T15:37:16Z
[INFO] ------------------------------------------------------------------------
error: etcdserver: request is too large
Congratulations! No build failures found for entando-k8s-keycloak-controller-PR-22.

Showing logs for build [32mentando-k8s-entando-k8s-keycloa-9sjbq-1[0m stage [32mfrom-build-pack[0m and container [32mstep-build-container-build[0m
Generating tags...
 - entando/entando-k8s-keycloak-controller -> docker.io/entando/entando-k8s-keycloak-controller:0.0.0-SNAPSHOT-PR-22-1
Checking cache...
 - entando/entando-k8s-keycloak-controller: Not found. Building
Building [entando/entando-k8s-keycloak-controller]...
Sending build context to Docker daemon  155.6kB
Step 1/7 : FROM entando/entando-k8s-operator-common:6.3.1
 ---> 1766f844aece
Step 2/7 : ARG VERSION
 ---> Using cache
 ---> 6a4149ee7662
Step 3/7 : LABEL name "Entando K8S Keycloak Controller" vendor "Entando" version "v${VERSION}" release "6" summary "This container processes EntandoKeycloakServer custom resources." description "This is a run-to-completion container. It will deploy a Keycloak or RedHat SSO server to your cluster                    Subsequent e**cutions of this container against the same EntandoKeycloakServer will patch the existing                    deployment resources"
 ---> Running in e5861cd0d341
 ---> 44163665dcf5
Step 4/7 : ENV JAVA_OPTIONS "-Djava.util.logging.manager=org.jboss.logmanager.LogManager"
 ---> Running in 1025a65e4f08
 ---> 1f94fe19b02b
Step 5/7 : ENV AB_ENABLED jmx_exporter
 ---> Running in eeac8f557289
 ---> 0f2f6d53da81
Step 6/7 : COPY target/*-runner.jar /deployments/app.jar
 ---> f30094a7c5a6
Step 7/7 : ENTRYPOINT /deployments/run-java.sh
 ---> Running in 866bae01969b
 ---> b0e0b7e76472
Successfully built b0e0b7e76472
The push refers to a repository [docker.io/entando/entando-k8s-keycloak-controller]
3ced2da80054: Preparing
9c2039494f82: Preparing
128e365e30f9: Preparing
712a16020a60: Preparing
088e643aafac: Preparing
00af10937683: Preparing
3aa55ff7bca1: Preparing
00af10937683: Waiting
3aa55ff7bca1: Waiting
9c2039494f82: Layer already exists
088e643aafac: Layer already exists
128e365e30f9: Layer already exists
712a16020a60: Layer already exists
00af10937683: Layer already exists
3aa55ff7bca1: Layer already exists
3ced2da80054: Pushed
0.0.0-SNAPSHOT-PR-22-1: digest: sha256:a236d45528907777e2a3991a34db419700a53b7680f3436b9622eda5f0bae46e size: 1791
There is a new version (1.20.0) of Skaffold available. Download it at https://storage.googleapis.com/skaffold/releases/latest/skaffold-linux-amd64


Showing logs for build [32mentando-k8s-entando-k8s-keycloa-9sjbq-1[0m stage [32mfrom-build-pack[0m and container [32mstep-postbuild-post-build[0m
no CVE provider running in the current ** namespace so skip adding image to be analysed

Showing logs for build [32mentando-k8s-entando-k8s-keycloa-9sjbq-1[0m stage [32mfrom-build-pack[0m and container [32mstep-promote-make-preview[0m
Creating /builder/home/.helm 
Creating /builder/home/.helm/repository 
Creating /builder/home/.helm/repository/cache 
Creating /builder/home/.helm/repository/local 
Creating /builder/home/.helm/plugins 
Creating /builder/home/.helm/starters 
Creating /builder/home/.helm/cache/archive 
Creating /builder/home/.helm/repository/repositories.yaml 
Adding stable repo with URL: https://charts.helm.sh/stable 
Adding local repo with URL: http://127.0.0.1:8879/charts 
$HELM_HOME has been configured at /builder/home/.helm.
Not installing Tiller due to 'client-only' flag having been set
sed -i -e "s/version:.*/version: 0.0.0-SNAPSHOT-PR-22-1/" Chart.yaml
sed -i -e "s/version:.*/version: 0.0.0-SNAPSHOT-PR-22-1/" ../*/Chart.yaml
sed -i -e "s|repository:.*|repository: docker.io\/entando\/entando-k8s-keycloak-controller|" values.yaml
sed -i -e "s/tag:.*/tag: 0.0.0-SNAPSHOT-PR-22-1/" values.yaml
echo "  version: 0.0.0-SNAPSHOT-PR-22-1" >> requirements.yaml
** step helm build
WARNING: No $CHART_REPOSITORY defined so using the default value of: http://jenkins-x-chartmuseum:8080
Adding missing Helm repo: storage.googleapis.com https://storage.googleapis.com/chartmuseum.jenkins-x.io
Successfully added Helm repository storage.googleapis.com.
Adding missing Helm repo: jenkins-x-chartmuseum http://jenkins-x-chartmuseum:8080
Successfully added Helm repository jenkins-x-chartmuseum.
WARNING: No $CHART_REPOSITORY defined so using the default value of: http://jenkins-x-chartmuseum:8080

Showing logs for build [32mentando-k8s-entando-k8s-keycloa-9sjbq-1[0m stage [32mfrom-build-pack[0m and container [32mstep-promote-jx-preview[0m
Creating a preview
Found commit author match for: ampie with email address: ampie.private@gmail.com
Created environment entando-k8s-keycloak-controller-kcpr22
Namespace entando-k8s-keycloak-controller-kcpr22 created 
expose:
  Annotations:
    helm.sh/hook: post-install,post-upgrade
    helm.sh/hook-delete-policy: hook-succeeded
  config:
    domain: *************
    exposer: Ingress
    http: "****"
preview:
  image:
    repository: docker.io/entando/entando-k8s-keycloak-controller
    tag: 0.0.0-SNAPSHOT-PR-22-1

WARNING: Could not find the service URL in namespace entando-k8s-keycloak-controller-kcpr22 for names : Timed out after 1m0s, last error: %!s(<nil>)
Updating PipelineActivities entando-k8s-entando-k8s-keycloak-controller-pr-22-1 which has status Running
WARNING: Failed to find the service entando-k8s-keycloak-controller : failed to find service entando-k8s-keycloak-controller in namespace entando-k8s-keycloak-controller-kcpr22: services "entando-k8s-keycloak-controller" not found

Showing logs for build [32mentando-k8s-entando-k8s-keycloa-9sjbq-1[0m stage [32mfrom-build-pack[0m and container [32mstep-promote-run-post-deployment-tests[0m
Picked up _JAVA_OPTIONS: -XX:+UnlockExperimentalVMOptions -Dsun.zip.disableMemoryMapping=**** -XX:+UseParallelGC -XX:MinHeapFreeRatio=5 -XX:MaxHeapFreeRatio=10 -XX:GCTimeRatio=4 -XX:AdaptiveSizePolicyWeight=90 -Xms1000m -Xmx12000m
[INFO] Scanning for projects...
[INFO] 
[INFO] ------------< org.entando:entando-k8s-keycloak-controller >-------------
[INFO] Building Entando K8S Controller for Keycloak 0.0.0-SNAPSHOT-PR-22-1
[INFO] --------------------------------[ jar ]---------------------------------
[INFO] 
[INFO] --- maven-resources-plugin:2.6:resources (default-resources) @ entando-k8s-keycloak-controller ---
[INFO] Using 'UTF-8' encoding to copy filtered resources.
[INFO] Copying 4 resources
[INFO] 
[INFO] --- maven-compiler-plugin:3.8.1:compile (default-compile) @ entando-k8s-keycloak-controller ---
[INFO] Nothing to compile - all classes are up to date
[INFO] 
[INFO] --- maven-resources-plugin:2.6:testResources (default-testResources) @ entando-k8s-keycloak-controller ---
[INFO] Using 'UTF-8' encoding to copy filtered resources.
[INFO] Copying 6 resources
[INFO] 
[INFO] --- maven-compiler-plugin:3.8.1:testCompile (default-testCompile) @ entando-k8s-keycloak-controller ---
[INFO] Nothing to compile - all classes are up to date
[INFO] 
[INFO] --- maven-surefire-plugin:3.0.0-M1:test (default-test) @ entando-k8s-keycloak-controller ---
[INFO] Tests are skipped.
[INFO] 
[INFO] --- maven-jar-plugin:3.2.0:jar (default-jar) @ entando-k8s-keycloak-controller ---
[INFO] 
[INFO] --- maven-jar-plugin:3.2.0:test-jar (build-test-jar) @ entando-k8s-keycloak-controller ---
[INFO] 
[INFO] --- maven-failsafe-plugin:3.0.0-M4:integration-test (run-tests) @ entando-k8s-keycloak-controller ---
[INFO] 
[INFO] -------------------------------------------------------
[INFO]  T E S T S
[INFO] -------------------------------------------------------
[INFO] Running org.entando.kubernetes.controller.keycloakserver.interprocesstests.AddEntandoKeycloakServerWithContainerizedDatabaseIT
Feb 18, 2021 3:39:33 PM org.entando.kubernetes.client.integrationtesthelpers.DeletionWaiter lambda$deleteSingleItem$2
WARNING: Deleting pods  entando-k8s-keycloak-controller-kcpr22/pg-test
Feb 18, 2021 3:39:33 PM org.entando.kubernetes.client.KubernetesRestInterceptor invoke
INFO: Entering method loadDockerImageInfoConfigMap in class org.entando.kubernetes.controller.support.client.EntandoResourceClient
Feb 18, 2021 3:39:33 PM org.entando.kubernetes.client.KubernetesRestInterceptor invoke
INFO: Exiting method loadDockerImageInfoConfigMap in class org.entando.kubernetes.controller.support.client.EntandoResourceClient
Feb 18, 2021 3:39:33 PM org.entando.kubernetes.client.KubernetesRestInterceptor invoke
INFO: Entering method loadDockerImageInfoConfigMap in class org.entando.kubernetes.controller.support.client.EntandoResourceClient
Feb 18, 2021 3:39:33 PM org.entando.kubernetes.client.KubernetesRestInterceptor invoke
INFO: Exiting method loadDockerImageInfoConfigMap in class org.entando.kubernetes.controller.support.client.EntandoResourceClient
!!!!!!!On EntandoKeycloakServer add!!!!!!!!!
Feb 18, 2021 3:39:33 PM org.entando.kubernetes.client.KubernetesRestInterceptor invoke
INFO: Entering method removeAndWait in class org.entando.kubernetes.controller.support.client.PodClient with entando-k8s-keycloak-controller-kcpr22,{EntandoResourceKind=EntandoKeycloakServer, EntandoResourceNamespace=entando-k8s-keycloak-controller-kcpr22, EntandoKeycloakServer=test-keycloak-kcpr22}
Feb 18, 2021 3:39:33 PM org.entando.kubernetes.client.KubernetesRestInterceptor invoke
INFO: Exiting method removeAndWait in class org.entando.kubernetes.controller.support.client.PodClient
Feb 18, 2021 3:39:33 PM org.entando.kubernetes.client.KubernetesRestInterceptor invoke
INFO: Entering method overwriteControllerSecret in class org.entando.kubernetes.controller.support.client.SecretClient with Secret: null/test-keycloak-kcpr22-controller-ca-cert-secret
Feb 18, 2021 3:39:33 PM org.entando.kubernetes.client.KubernetesRestInterceptor invoke
INFO: Exiting method overwriteControllerSecret in class org.entando.kubernetes.controller.support.client.SecretClient
Feb 18, 2021 3:39:33 PM org.entando.kubernetes.client.KubernetesRestInterceptor invoke
INFO: Entering method overwriteControllerSecret in class org.entando.kubernetes.controller.support.client.SecretClient with Secret: null/test-keycloak-kcpr22-controller-tls-secret
Feb 18, 2021 3:39:34 PM org.entando.kubernetes.client.KubernetesRestInterceptor invoke
INFO: Exiting method overwriteControllerSecret in class org.entando.kubernetes.controller.support.client.SecretClient
Feb 18, 2021 3:39:34 PM org.entando.kubernetes.client.KubernetesRestInterceptor invoke
INFO: Entering method start in class org.entando.kubernetes.controller.support.client.PodClient with Pod: entando-k8s-keycloak-controller-kcpr22/test-keycloak-kcpr22-deployer-1756
Feb 18, 2021 3:39:34 PM org.entando.kubernetes.client.KubernetesRestInterceptor invoke
INFO: Exiting method start in class org.entando.kubernetes.controller.support.client.PodClient
Feb 18, 2021 3:40:20 PM org.entando.kubernetes.client.integrationtesthelpers.DeletionWaiter lambda$deleteSingleItem$2
WARNING: Deleting pods  entando-k8s-keycloak-controller-kcpr22/test-keycloak-kcpr22-deployer-1756
Feb 18, 2021 3:40:21 PM org.entando.kubernetes.client.integrationtesthelpers.DeletionWaiter lambda$deleteSingleItem$2
WARNING: Deleting pods  entando-k8s-keycloak-controller-kcpr22/pg-test
Feb 18, 2021 3:40:21 PM org.entando.kubernetes.client.KubernetesRestInterceptor invoke
INFO: Entering method loadDockerImageInfoConfigMap in class org.entando.kubernetes.controller.support.client.EntandoResourceClient
Feb 18, 2021 3:40:21 PM org.entando.kubernetes.client.KubernetesRestInterceptor invoke
INFO: Exiting method loadDockerImageInfoConfigMap in class org.entando.kubernetes.controller.support.client.EntandoResourceClient
Feb 18, 2021 3:40:21 PM org.entando.kubernetes.client.KubernetesRestInterceptor invoke
INFO: Entering method loadDockerImageInfoConfigMap in class org.entando.kubernetes.controller.support.client.EntandoResourceClient
Feb 18, 2021 3:40:21 PM org.entando.kubernetes.client.KubernetesRestInterceptor invoke
INFO: Exiting method loadDockerImageInfoConfigMap in class org.entando.kubernetes.controller.support.client.EntandoResourceClient
!!!!!!!On EntandoKeycloakServer add!!!!!!!!!
Feb 18, 2021 3:40:21 PM org.entando.kubernetes.client.KubernetesRestInterceptor invoke
INFO: Entering method removeAndWait in class org.entando.kubernetes.controller.support.client.PodClient with entando-k8s-keycloak-controller-kcpr22,{EntandoResourceKind=EntandoKeycloakServer, EntandoResourceNamespace=entando-k8s-keycloak-controller-kcpr22, EntandoKeycloakServer=test-keycloak-kcpr22}
Feb 18, 2021 3:40:22 PM org.entando.kubernetes.client.KubernetesRestInterceptor invoke
INFO: Exiting method removeAndWait in class org.entando.kubernetes.controller.support.client.PodClient
Feb 18, 2021 3:40:22 PM org.entando.kubernetes.client.KubernetesRestInterceptor invoke
INFO: Entering method overwriteControllerSecret in class org.entando.kubernetes.controller.support.client.SecretClient with Secret: null/test-keycloak-kcpr22-controller-ca-cert-secret
Feb 18, 2021 3:40:22 PM org.entando.kubernetes.client.KubernetesRestInterceptor invoke
INFO: Exiting method overwriteControllerSecret in class org.entando.kubernetes.controller.support.client.SecretClient
Feb 18, 2021 3:40:22 PM org.entando.kubernetes.client.KubernetesRestInterceptor invoke
INFO: Entering method overwriteControllerSecret in class org.entando.kubernetes.controller.support.client.SecretClient with Secret: null/test-keycloak-kcpr22-controller-tls-secret
Feb 18, 2021 3:40:22 PM org.entando.kubernetes.client.KubernetesRestInterceptor invoke
INFO: Exiting method overwriteControllerSecret in class org.entando.kubernetes.controller.support.client.SecretClient
Feb 18, 2021 3:40:22 PM org.entando.kubernetes.client.KubernetesRestInterceptor invoke
INFO: Entering method start in class org.entando.kubernetes.controller.support.client.PodClient with Pod: entando-k8s-keycloak-controller-kcpr22/test-keycloak-kcpr22-deployer-1151
Feb 18, 2021 3:40:22 PM org.entando.kubernetes.client.KubernetesRestInterceptor invoke
INFO: Exiting method start in class org.entando.kubernetes.controller.support.client.PodClient
[ERROR] Tests run: 2, Failures: 0, Errors: 2, Skipped: 0, Time elapsed: 97.996 s <<< FAILURE! - in org.entando.kubernetes.controller.keycloakserver.interprocesstests.AddEntandoKeycloakServerWithContainerizedDatabaseIT
[ERROR] org.entando.kubernetes.controller.keycloakserver.interprocesstests.AddEntandoKeycloakServerWithContainerizedDatabaseIT.create(EntandoOperatorComplianceMode)[1]  Time elapsed: 47.333 s  <<< ERROR!
org.awaitility.core.ConditionTimeoutException: Condition with lambda expression in org.entando.kubernetes.test.e2etest.helpers.E2ETestHelperBase was not fulfilled within 45 seconds.
	at org.entando.kubernetes.controller.keycloakserver.interprocesstests.AddEntandoKeycloakServerWithContainerizedDatabaseIT.create(AddEntandoKeycloakServerWithContainerizedDatabaseIT.java:69)

[ERROR] org.entando.kubernetes.controller.keycloakserver.interprocesstests.AddEntandoKeycloakServerWithContainerizedDatabaseIT.create(EntandoOperatorComplianceMode)[2]  Time elapsed: 47.15 s  <<< ERROR!
org.awaitility.core.ConditionTimeoutException: Condition with lambda expression in org.entando.kubernetes.test.e2etest.helpers.E2ETestHelperBase was not fulfilled within 45 seconds.
	at org.entando.kubernetes.controller.keycloakserver.interprocesstests.AddEntandoKeycloakServerWithContainerizedDatabaseIT.create(AddEntandoKeycloakServerWithContainerizedDatabaseIT.java:69)

[INFO] Running org.entando.kubernetes.controller.keycloakserver.interprocesstests.AddEntandoKeycloakServerWithExternalPostgresqlDatabaseIT
Feb 18, 2021 3:41:08 PM org.entando.kubernetes.client.integrationtesthelpers.DeletionWaiter lambda$deleteSingleItem$2
WARNING: Deleting pods  entando-k8s-keycloak-controller-kcpr22/test-keycloak-kcpr22-deployer-1151
Feb 18, 2021 3:41:09 PM org.entando.kubernetes.client.integrationtesthelpers.DeletionWaiter lambda$deleteSingleItem$2
WARNING: Deleting pods  entando-k8s-keycloak-controller-kcpr22/pg-test
Feb 18, 2021 3:41:09 PM org.entando.kubernetes.client.KubernetesRestInterceptor invoke
INFO: Entering method loadDockerImageInfoConfigMap in class org.entando.kubernetes.controller.support.client.EntandoResourceClient
Feb 18, 2021 3:41:09 PM org.entando.kubernetes.client.KubernetesRestInterceptor invoke
INFO: Exiting method loadDockerImageInfoConfigMap in class org.entando.kubernetes.controller.support.client.EntandoResourceClient
Feb 18, 2021 3:41:09 PM org.entando.kubernetes.client.KubernetesRestInterceptor invoke
INFO: Entering method loadDockerImageInfoConfigMap in class org.entando.kubernetes.controller.support.client.EntandoResourceClient
Feb 18, 2021 3:41:09 PM org.entando.kubernetes.client.KubernetesRestInterceptor invoke
INFO: Exiting method loadDockerImageInfoConfigMap in class org.entando.kubernetes.controller.support.client.EntandoResourceClient
Feb 18, 2021 3:41:09 PM org.entando.kubernetes.client.integrationtesthelpers.DeletionWaiter lambda$deleteSingleItem$2
WARNING: Deleting pods  entando-k8s-keycloak-controller-kcpr22/pg-test
Feb 18, 2021 3:41:10 PM org.entando.kubernetes.client.integrationtesthelpers.DeletionWaiter lambda$deleteSingleItem$2
WARNING: Deleting entandodatabaseservices  entando-k8s-keycloak-controller-kcpr22/my-external-db-kcpr22
Feb 18, 2021 3:41:10 PM org.entando.kubernetes.client.integrationtesthelpers.DeletionWaiter lambda$deleteSingleItem$2
WARNING: Deleting secrets  entando-k8s-keycloak-controller-kcpr22/test-secret
ADDED:PodStatus(conditions=[PodCondition(lastProbeTime=null, lastTransitionTime=2021-02-18T15:41:10Z, message=null, reason=null, status=True, type=PodScheduled, additionalProperties={})], containerStatuses=[], ephemeralContainerStatuses=[], hostIP=null, initContainerStatuses=[], message=null, nominatedNodeName=null, phase=Pending, podIP=null, podIPs=[], qosClass=BestEffort, reason=null, startTime=null, additionalProperties={})
MODIFIED:PodStatus(conditions=[PodCondition(lastProbeTime=null, lastTransitionTime=2021-02-18T15:41:10Z, message=null, reason=null, status=True, type=Initialized, additionalProperties={}), PodCondition(lastProbeTime=null, lastTransitionTime=2021-02-18T15:41:10Z, message=containers with unready status: [pg-container], reason=ContainersNotReady, status=False, type=Ready, additionalProperties={}), PodCondition(lastProbeTime=null, lastTransitionTime=null, message=containers with unready status: [pg-container], reason=ContainersNotReady, status=False, type=ContainersReady, additionalProperties={}), PodCondition(lastProbeTime=null, lastTransitionTime=2021-02-18T15:41:10Z, message=null, reason=null, status=True, type=PodScheduled, additionalProperties={})], containerStatuses=[ContainerStatus(containerID=null, image=centos/********ql-96-centos7:latest, imageID=, lastState=ContainerState(running=null, terminated=null, waiting=null, additionalProperties={}), name=pg-container, ready=false, restartCount=0, started=null, state=ContainerState(running=null, terminated=null, waiting=ContainerStateWaiting(message=null, reason=ContainerCreating, additionalProperties={}), additionalProperties={}), additionalProperties={})], ephemeralContainerStatuses=[], hostIP=54.36.53.206, initContainerStatuses=[], message=null, nominatedNodeName=null, phase=Pending, podIP=null, podIPs=[], qosClass=BestEffort, reason=null, startTime=2021-02-18T15:41:10Z, additionalProperties={})
MODIFIED:PodStatus(conditions=[PodCondition(lastProbeTime=null, lastTransitionTime=2021-02-18T15:41:10Z, message=null, reason=null, status=True, type=Initialized, additionalProperties={}), PodCondition(lastProbeTime=null, lastTransitionTime=2021-02-18T15:41:10Z, message=containers with unready status: [pg-container], reason=ContainersNotReady, status=False, type=Ready, additionalProperties={}), PodCondition(lastProbeTime=null, lastTransitionTime=null, message=containers with unready status: [pg-container], reason=ContainersNotReady, status=False, type=ContainersReady, additionalProperties={}), PodCondition(lastProbeTime=null, lastTransitionTime=2021-02-18T15:41:10Z, message=null, reason=null, status=True, type=PodScheduled, additionalProperties={})], containerStatuses=[ContainerStatus(containerID=docker://d74a39186aa04c127ed706dcfae780169df478e75eeaba4e32f8227228e3932b, image=docker.io/centos/********ql-96-centos7:latest, imageID=docker-pullable://docker.io/centos/********ql-96-centos7@sha256:b681d78125361519180a6ac05242c296f8906c11eab7e207b5ca9a89b6344392, lastState=ContainerState(running=null, terminated=null, waiting=null, additionalProperties={}), name=pg-container, ready=false, restartCount=0, started=null, state=ContainerState(running=ContainerStateRunning(startedAt=2021-02-18T15:41:15Z, additionalProperties={}), terminated=null, waiting=null, additionalProperties={}), additionalProperties={})], ephemeralContainerStatuses=[], hostIP=54.36.53.206, initContainerStatuses=[], message=null, nominatedNodeName=null, phase=Running, podIP=10.128.1.60, podIPs=[], qosClass=BestEffort, reason=null, startTime=2021-02-18T15:41:10Z, additionalProperties={})
MODIFIED:PodStatus(conditions=[PodCondition(lastProbeTime=null, lastTransitionTime=2021-02-18T15:41:10Z, message=null, reason=null, status=True, type=Initialized, additionalProperties={}), PodCondition(lastProbeTime=null, lastTransitionTime=2021-02-18T15:41:23Z, message=null, reason=null, status=True, type=Ready, additionalProperties={}), PodCondition(lastProbeTime=null, lastTransitionTime=null, message=null, reason=null, status=True, type=ContainersReady, additionalProperties={}), PodCondition(lastProbeTime=null, lastTransitionTime=2021-02-18T15:41:10Z, message=null, reason=null, status=True, type=PodScheduled, additionalProperties={})], containerStatuses=[ContainerStatus(containerID=docker://d74a39186aa04c127ed706dcfae780169df478e75eeaba4e32f8227228e3932b, image=docker.io/centos/********ql-96-centos7:latest, imageID=docker-pullable://docker.io/centos/********ql-96-centos7@sha256:b681d78125361519180a6ac05242c296f8906c11eab7e207b5ca9a89b6344392, lastState=ContainerState(running=null, terminated=null, waiting=null, additionalProperties={}), name=pg-container, ready=****, restartCount=0, started=null, state=ContainerState(running=ContainerStateRunning(startedAt=2021-02-18T15:41:15Z, additionalProperties={}), terminated=null, waiting=null, additionalProperties={}), additionalProperties={})], ephemeralContainerStatuses=[], hostIP=54.36.53.206, initContainerStatuses=[], message=null, nominatedNodeName=null, phase=Running, podIP=10.128.1.60, podIPs=[], qosClass=BestEffort, reason=null, startTime=2021-02-18T15:41:10Z, additionalProperties={})
Finished: pg-test
Feb 18, 2021 3:41:23 PM org.entando.kubernetes.client.KubernetesRestInterceptor invoke
INFO: Entering method createOrReplaceService in class org.entando.kubernetes.controller.support.client.ServiceClient with EntandoDatabaseService: entando-k8s-keycloak-controller-kcpr22/my-external-db-kcpr22 and with Service: entando-k8s-keycloak-controller-kcpr22/my-external-db-kcpr22-db-service
Feb 18, 2021 3:41:23 PM org.entando.kubernetes.client.KubernetesRestInterceptor invoke
INFO: Exiting method createOrReplaceService in class org.entando.kubernetes.controller.support.client.ServiceClient
Feb 18, 2021 3:41:23 PM org.entando.kubernetes.client.KubernetesRestInterceptor invoke
INFO: Entering method createOrReplaceEndpoints in class org.entando.kubernetes.controller.support.client.ServiceClient with EntandoDatabaseService: entando-k8s-keycloak-controller-kcpr22/my-external-db-kcpr22 and with Endpoints: entando-k8s-keycloak-controller-kcpr22/my-external-db-kcpr22-db-service
Feb 18, 2021 3:41:23 PM org.entando.kubernetes.client.KubernetesRestInterceptor invoke
INFO: Exiting method createOrReplaceEndpoints in class org.entando.kubernetes.controller.support.client.ServiceClient
!!!!!!!On EntandoKeycloakServer add!!!!!!!!!
Feb 18, 2021 3:41:23 PM org.entando.kubernetes.client.KubernetesRestInterceptor invoke
INFO: Entering method removeAndWait in class org.entando.kubernetes.controller.support.client.PodClient with entando-k8s-keycloak-controller-kcpr22,{EntandoResourceKind=EntandoKeycloakServer, EntandoResourceNamespace=entando-k8s-keycloak-controller-kcpr22, EntandoKeycloakServer=test-keycloak-kcpr22}
Feb 18, 2021 3:41:24 PM org.entando.kubernetes.client.KubernetesRestInterceptor invoke
INFO: Exiting method removeAndWait in class org.entando.kubernetes.controller.support.client.PodClient
Feb 18, 2021 3:41:24 PM org.entando.kubernetes.client.KubernetesRestInterceptor invoke
INFO: Entering method overwriteControllerSecret in class org.entando.kubernetes.controller.support.client.SecretClient with Secret: null/test-keycloak-kcpr22-controller-ca-cert-secret
Feb 18, 2021 3:41:24 PM org.entando.kubernetes.client.KubernetesRestInterceptor invoke
INFO: Exiting method overwriteControllerSecret in class org.entando.kubernetes.controller.support.client.SecretClient
Feb 18, 2021 3:41:24 PM org.entando.kubernetes.client.KubernetesRestInterceptor invoke
INFO: Entering method overwriteControllerSecret in class org.entando.kubernetes.controller.support.client.SecretClient with Secret: null/test-keycloak-kcpr22-controller-tls-secret
Feb 18, 2021 3:41:24 PM org.entando.kubernetes.client.KubernetesRestInterceptor invoke
INFO: Exiting method overwriteControllerSecret in class org.entando.kubernetes.controller.support.client.SecretClient
Feb 18, 2021 3:41:24 PM org.entando.kubernetes.client.KubernetesRestInterceptor invoke
INFO: Entering method start in class org.entando.kubernetes.controller.support.client.PodClient with Pod: entando-k8s-keycloak-controller-kcpr22/test-keycloak-kcpr22-deployer-8815
Feb 18, 2021 3:41:24 PM org.entando.kubernetes.client.KubernetesRestInterceptor invoke
INFO: Exiting method start in class org.entando.kubernetes.controller.support.client.PodClient
[ERROR] Tests run: 1, Failures: 0, Errors: 1, Skipped: 0, Time elapsed: 61.941 s <<< FAILURE! - in org.entando.kubernetes.controller.keycloakserver.interprocesstests.AddEntandoKeycloakServerWithExternalPostgresqlDatabaseIT
[ERROR] org.entando.kubernetes.controller.keycloakserver.interprocesstests.AddEntandoKeycloakServerWithExternalPostgresqlDatabaseIT.create  Time elapsed: 61.052 s  <<< ERROR!
org.awaitility.core.ConditionTimeoutException: Condition with lambda expression in org.entando.kubernetes.test.e2etest.helpers.E2ETestHelperBase was not fulfilled within 45 seconds.
	at org.entando.kubernetes.controller.keycloakserver.interprocesstests.AddEntandoKeycloakServerWithExternalPostgresqlDatabaseIT.create(AddEntandoKeycloakServerWithExternalPostgresqlDatabaseIT.java:53)

[INFO] 
[INFO] Results:
[INFO] 
[ERROR] Errors: 
[ERROR]   AddEntandoKeycloakServerWithContainerizedDatabaseIT.create:69 » ConditionTimeout
[ERROR]   AddEntandoKeycloakServerWithContainerizedDatabaseIT.create:69 » ConditionTimeout
[ERROR]   AddEntandoKeycloakServerWithExternalPostgresqlDatabaseIT.create:53 » ConditionTimeout
[INFO] 
[ERROR] Tests run: 3, Failures: 0, Errors: 3, Skipped: 0
[INFO] 
[INFO] 
[INFO] --- maven-surefire-report-plugin:3.0.0-M4:failsafe-report-only (integration-tests) @ entando-k8s-keycloak-controller ---
[WARNING] Unable to locate Test Source XRef to link to - DISABLED
[INFO] 
[INFO] --- maven-surefire-report-plugin:3.0.0-M4:report-only (unit-tests) @ entando-k8s-keycloak-controller ---
[WARNING] Unable to locate Test Source XRef to link to - DISABLED
[INFO] 
[INFO] --- maven-failsafe-plugin:3.0.0-M4:verify (run-tests) @ entando-k8s-keycloak-controller ---
[ERROR] There are test failures.

Please refer to /workspace/source/target/failsafe-reports for the individual test results.
Please refer to dump files (if any exist) [date].dump, [date]-***Run[N].dump and [date].dumpstream.
[INFO] 
[INFO] --- maven-site-plugin:3.9.0:site (default-site) @ entando-k8s-keycloak-controller ---
[INFO] configuring report plugin org.apache.maven.plugins:maven-project-info-reports-plugin:3.0.0
[INFO] 9 reports configured for maven-project-info-reports-plugin:3.0.0: dependency-info, distribution-management, index, ci-management, issue-management, licenses, plugins, scm, summary
[INFO] Rendering site with default locale English (en)
[WARNING] Unable to find a URL to the parent project. The parent menu will NOT be added.
[INFO] Relativizing decoration links with respect to localized project URL: https://central.entando.com
[INFO] Rendering content with org.apache.maven.skins:maven-default-skin:jar:1.3 skin.
[INFO] Generating "Dependency Information" report --- maven-project-info-reports-plugin:3.0.0:dependency-info
[INFO] Generating "About" report         --- maven-project-info-reports-plugin:3.0.0:index
[INFO] Generating "Issue Management" report --- maven-project-info-reports-plugin:3.0.0:issue-management
[INFO] Generating "Licenses" report      --- maven-project-info-reports-plugin:3.0.0:licenses
[INFO] Generating "Plugins" report       --- maven-project-info-reports-plugin:3.0.0:plugins
[INFO] Generating "Source Code Management" report --- maven-project-info-reports-plugin:3.0.0:scm
[INFO] Generating "Summary" report       --- maven-project-info-reports-plugin:3.0.0:summary
[INFO] ------------------------------------------------------------------------
[INFO] BUILD SUCCESS
[INFO] ------------------------------------------------------------------------
[INFO] Total time:  02:50 min
[INFO] Finished at: 2021-02-18T15:42:13Z
[INFO] ------------------------------------------------------------------------
error: etcdserver: request is too large
Post-deployment tests failed for entando-k8s-keycloak-controller-PR-22.
[31m
Pipeline failed on stage 'from-build-pack' : container 'step-promote-run-post-deployment-tests'. The execution of the pipeline has stopped.[0m
