
Showing logs for build [32mentando-k8s-entando-k8s-cluster-9btr7-2[0m stage [32mfrom-build-pack[0m and container [32mstep-credential-initializer-st7r7[0m
{"level":"warn","ts":1616764286.8587883,"logger":"fallback-logger","caller":"logging/config.go:69","msg":"Fetch GitHub commit ID from kodata failed: \"ref: refs/heads/0.8.0-**-support-backwards-incompats\" is not a valid GitHub commit ID"}
{"level":"info","ts":1616764286.8628318,"logger":"fallback-logger","caller":"creds-init/main.go:40","msg":"Credentials initialized."}

Showing logs for build [32mentando-k8s-entando-k8s-cluster-9btr7-2[0m stage [32mfrom-build-pack[0m and container [32mstep-working-dir-initializer-bhlhn[0m
{"level":"warn","ts":1616764290.2739866,"logger":"fallback-logger","caller":"logging/config.go:69","msg":"Fetch GitHub commit ID from kodata failed: open /var/run/ko/HEAD: no such file or directory"}
{"level":"info","ts":1616764290.2846003,"logger":"fallback-logger","caller":"bash/main.go:64","msg":"Successfully e**cuted command \"sh -c mkdir -p /workspace/source\"; output "}

Showing logs for build [32mentando-k8s-entando-k8s-cluster-9btr7-2[0m stage [32mfrom-build-pack[0m and container [32mstep-place-tools[0m

Showing logs for build [32mentando-k8s-entando-k8s-cluster-9btr7-2[0m stage [32mfrom-build-pack[0m and container [32mstep-git-source-entando-k8s-entando-k8s-cluster-mfx2q[0m
{"level":"warn","ts":1616764310.9353518,"logger":"fallback-logger","caller":"logging/config.go:69","msg":"Fetch GitHub commit ID from kodata failed: \"ref: refs/heads/0.8.0-**-support-backwards-incompats\" is not a valid GitHub commit ID"}
{"level":"info","ts":1616764311.641346,"logger":"fallback-logger","caller":"git/git.go:103","msg":"Successfully cloned https://github.com/entando-k8s/entando-k8s-cluster-infrastructure-controller.git @ master in path /workspace/source"}

Showing logs for build [32mentando-k8s-entando-k8s-cluster-9btr7-2[0m stage [32mfrom-build-pack[0m and container [32mstep-git-merge[0m
Using SHAs from PULL_REFS=master:bad36ca782324a3779344f63a1344f98ca7c96d4,21:4048f98600687c5b027f333795bb8c522d171ca3
DEBUG: ran git fetch --unshallow origin 4048f98600687c5b027f333795bb8c522d171ca3: bad36ca782324a3779344f63a1344f98ca7c96d4: in 
DEBUG: ran git checkout master in 
DEBUG: ran git reset --hard bad36ca782324a3779344f63a1344f98ca7c96d4 in 
DEBUG: ran clean --force -d . in 
DEBUG: ran git merge 4048f98600687c5b027f333795bb8c522d171ca3 in 
Merged SHA 4048f98600687c5b027f333795bb8c522d171ca3 with commit message 'Update OWNERS' into base branch master
Merged SHA 682aa33bd780c928bc821cb62720cdc95a45164f with commit message 'ENG-2068 update common base image for ubi change' into base branch master

Showing logs for build [32mentando-k8s-entando-k8s-cluster-9btr7-2[0m stage [32mfrom-build-pack[0m and container [32mstep-build-set-version[0m
Picked up _JAVA_OPTIONS: -XX:+UnlockExperimentalVMOptions -Dsun.zip.disableMemoryMapping=**** -XX:+UseParallelGC -XX:MinHeapFreeRatio=5 -XX:MaxHeapFreeRatio=10 -XX:GCTimeRatio=4 -XX:AdaptiveSizePolicyWeight=90 -Xms1000m -Xmx12000m
[INFO] Scanning for projects...
[INFO] 
[INFO] -----< org.entando:entando-k8s-cluster-infrastructure-controller >------
[INFO] Building Entando K8S Controller for Entando Cluster Infrastructure Deployments 6.3.0-SNAPSHOT
[INFO] --------------------------------[ jar ]---------------------------------
[INFO] 
[INFO] --- versions-maven-plugin:2.8.1:set (default-cli) @ entando-k8s-cluster-infrastructure-controller ---
[INFO] Local aggregation ****: /workspace/source
[INFO] Processing change of org.entando:entando-k8s-cluster-infrastructure-controller:6.3.0-SNAPSHOT -> 0.0.0-SNAPSHOT-PR-21-2
[INFO] Processing org.entando:entando-k8s-cluster-infrastructure-controller
[INFO]     Updating project org.entando:entando-k8s-cluster-infrastructure-controller
[INFO]         from version 6.3.0-SNAPSHOT to 0.0.0-SNAPSHOT-PR-21-2
[INFO] 
[INFO] ------------------------------------------------------------------------
[INFO] BUILD SUCCESS
[INFO] ------------------------------------------------------------------------
[INFO] Total time:  14.553 s
[INFO] Finished at: 2021-03-26T13:12:10Z
[INFO] ------------------------------------------------------------------------

Showing logs for build [32mentando-k8s-entando-k8s-cluster-9btr7-2[0m stage [32mfrom-build-pack[0m and container [32mstep-build-fix-git-for-sonar[0m
M	pom.xml
Switched to a new branch 'PR-21'
Deleted branch master (was 4048f98).
From https://github.com/entando-k8s/entando-k8s-cluster-infrastructure-controller
 * [new branch]      master     -> master

Showing logs for build [32mentando-k8s-entando-k8s-cluster-9btr7-2[0m stage [32mfrom-build-pack[0m and container [32mstep-build-mvn-verify-pr[0m
Picked up _JAVA_OPTIONS: -XX:+UnlockExperimentalVMOptions -Dsun.zip.disableMemoryMapping=**** -XX:+UseParallelGC -XX:MinHeapFreeRatio=5 -XX:MaxHeapFreeRatio=10 -XX:GCTimeRatio=4 -XX:AdaptiveSizePolicyWeight=90 -Xms1000m -Xmx12000m
[INFO] Scanning for projects...
[INFO] 
[INFO] -----< org.entando:entando-k8s-cluster-infrastructure-controller >------
[INFO] Building Entando K8S Controller for Entando Cluster Infrastructure Deployments 0.0.0-SNAPSHOT-PR-21-2
[INFO] --------------------------------[ jar ]---------------------------------
[INFO] 
[INFO] --- maven-checkstyle-plugin:3.1.1:check (validate) @ entando-k8s-cluster-infrastructure-controller ---
[INFO] Starting audit...
Audit done.
[INFO] You have 0 Checkstyle violations.
[INFO] 
[INFO] --- maven-checkstyle-plugin:3.1.1:checkstyle (validate) @ entando-k8s-cluster-infrastructure-controller ---
[INFO] Starting audit...
Audit done.
[INFO] 
[INFO] --- jacoco-maven-plugin:0.8.5:prepare-agent (prepare-agent) @ entando-k8s-cluster-infrastructure-controller ---
[INFO] argLine set to -javaagent:/home/jenkins/.mvnrepository/org/jacoco/org.jacoco.agent/0.8.5/org.jacoco.agent-0.8.5-runtime.jar=destfile=/workspace/source/target/jacoco.e**c
[INFO] 
[INFO] --- maven-resources-plugin:2.6:resources (default-resources) @ entando-k8s-cluster-infrastructure-controller ---
[INFO] Using 'UTF-8' encoding to copy filtered resources.
[INFO] Copying 3 resources
[INFO] 
[INFO] --- maven-compiler-plugin:3.8.1:compile (default-compile) @ entando-k8s-cluster-infrastructure-controller ---
[INFO] Changes detected - recompiling the module!
[INFO] Compiling 5 source files to /workspace/source/target/classes
[INFO] 
[INFO] --- maven-resources-plugin:2.6:testResources (default-testResources) @ entando-k8s-cluster-infrastructure-controller ---
[INFO] Using 'UTF-8' encoding to copy filtered resources.
[INFO] Copying 3 resources
[INFO] 
[INFO] --- maven-compiler-plugin:3.8.1:testCompile (default-testCompile) @ entando-k8s-cluster-infrastructure-controller ---
[INFO] Changes detected - recompiling the module!
[INFO] Compiling 3 source files to /workspace/source/target/test-classes
[INFO] 
[INFO] --- maven-surefire-plugin:3.0.0-M1:test (default-test) @ entando-k8s-cluster-infrastructure-controller ---
[INFO] 
[INFO] -------------------------------------------------------
[INFO]  T E S T S
[INFO] -------------------------------------------------------
[INFO] Running org.entando.kubernetes.controller.clusterinfrastructure.inprocesstests.DeployEntandoClusterInfrastructureTest
[INFO] Tests run: 4, Failures: 0, Errors: 0, Skipped: 0, Time elapsed: 3.202 s - in org.entando.kubernetes.controller.clusterinfrastructure.inprocesstests.DeployEntandoClusterInfrastructureTest
[INFO] 
[INFO] Results:
[INFO] 
[INFO] Tests run: 4, Failures: 0, Errors: 0, Skipped: 0
[INFO] 
[INFO] 
[INFO] --- maven-jar-plugin:3.2.0:jar (default-jar) @ entando-k8s-cluster-infrastructure-controller ---
[INFO] Building jar: /workspace/source/target/entando-k8s-cluster-infrastructure-controller-0.0.0-SNAPSHOT-PR-21-2.jar
[INFO] 
[INFO] --- maven-jar-plugin:3.2.0:test-jar (build-test-jar) @ entando-k8s-cluster-infrastructure-controller ---
[INFO] Building jar: /workspace/source/target/entando-k8s-cluster-infrastructure-controller-0.0.0-SNAPSHOT-PR-21-2-tests.jar
[INFO] 
[INFO] --- maven-javadoc-plugin:3.2.0:jar (attach-javadocs) @ entando-k8s-cluster-infrastructure-controller ---
[INFO] No previous run data found, generating javadoc.
[INFO] Building jar: /workspace/source/target/entando-k8s-cluster-infrastructure-controller-0.0.0-SNAPSHOT-PR-21-2-javadoc.jar
[INFO] 
[INFO] --- license-maven-plugin:2.0.0:aggregate-download-licenses (download-licenses) @ entando-k8s-cluster-infrastructure-controller ---
[INFO] skip flag is on, will skip goal.
[INFO] 
[INFO] --- quarkus-maven-plugin:1.2.0.Final:build (default) @ entando-k8s-cluster-infrastructure-controller ---
[WARNING] [io.quarkus.creator.curator.Curator] These dependencies are not recommended:
	- javax.servlet:javax.servlet-api should be replaced by jakarta.servlet:jakarta.servlet-api
You might end up with two different versions of the same classes or with an artifact you shouldn't have in your classpath.
[INFO] [org.jboss.threads] JBoss Threads version 3.0.0.Final
[WARNING] [io.quarkus.deployment.steps.ReflectiveHierarchyStep] Unable to properly register the hierarchy of the following classes for reflection as they are not in the Jandex index:
	- org.entando.kubernetes.model.EntandoCustomResourceStatus
Consider adding them to the index either by creating a Jandex index for your dependency via the Maven plugin, an empty META-INF/beans.xml or quarkus.index-dependency properties.");.
[INFO] [io.quarkus.deployment.pkg.steps.JarResultBuildStep] Building thin jar: /workspace/source/target/entando-k8s-cluster-infrastructure-controller-0.0.0-SNAPSHOT-PR-21-2-runner.jar
[INFO] [io.quarkus.deployment.QuarkusAugmentor] Quarkus augmentation completed in 1608ms
[INFO] 
[INFO] --- maven-surefire-report-plugin:3.0.0-M4:failsafe-report-only (integration-tests) @ entando-k8s-cluster-infrastructure-controller ---
[INFO] 
[INFO] --- dependency-check-maven:6.0.3:aggregate (default) @ entando-k8s-cluster-infrastructure-controller ---
[INFO] Checking for updates
[INFO] Skipping NVD check since last check was within 4 hours.
[INFO] Check for updates complete (55 ms)
[INFO] 

Dependency-Check is an open source tool performing a best effort analysis of 3rd party dependencies; false positives and false negatives may exist in the analysis performed by the tool. Use of the tool and the reporting provided constitutes acceptance for use in an AS IS condition, and there are NO warranties, implied or otherwise, with regard to the analysis or its use. Any use of the tool and the reporting provided is at the user’s risk. In no event shall the copyright holder or OWASP be held liable for any damages whatsoever arising out of or in connection with the use of this tool, the analysis performed, or the resulting report.


[INFO] Analysis Started
[INFO] Finished Archive Analyzer (0 seconds)
[INFO] Finished File Name Analyzer (0 seconds)
[INFO] Finished Jar Analyzer (0 seconds)
[INFO] Finished Dependency Merging Analyzer (0 seconds)
[INFO] Finished Version Filter Analyzer (0 seconds)
[INFO] Finished Hint Analyzer (0 seconds)
[INFO] Created CPE Index (2 seconds)
[INFO] Finished CPE Analyzer (4 seconds)
[INFO] Finished False Positive Analyzer (0 seconds)
[INFO] Finished NVD CVE Analyzer (0 seconds)
[INFO] Finished Sonatype OSS Index Analyzer (4 seconds)
[INFO] Finished Vulnerability Suppression Analyzer (0 seconds)
[INFO] Finished Dependency Bundling Analyzer (0 seconds)
[INFO] Analysis Complete (11 seconds)
[INFO] 
[INFO] --- jacoco-maven-plugin:0.8.5:report (report) @ entando-k8s-cluster-infrastructure-controller ---
[INFO] Loading e**cution data file /workspace/source/target/jacoco.e**c
[INFO] Analyzed bundle 'Entando K8S Controller for Entando Cluster Infrastructure Deployments' with 5 classes
[INFO] 
[INFO] --- maven-surefire-report-plugin:3.0.0-M4:report-only (unit-tests) @ entando-k8s-cluster-infrastructure-controller ---
[WARNING] Unable to locate Test Source XRef to link to - DISABLED
[INFO] 
[INFO] --- maven-install-plugin:2.4:install (default-install) @ entando-k8s-cluster-infrastructure-controller ---
[INFO] Installing /workspace/source/target/entando-k8s-cluster-infrastructure-controller-0.0.0-SNAPSHOT-PR-21-2.jar to /home/jenkins/.mvnrepository/org/entando/entando-k8s-cluster-infrastructure-controller/0.0.0-SNAPSHOT-PR-21-2/entando-k8s-cluster-infrastructure-controller-0.0.0-SNAPSHOT-PR-21-2.jar
[INFO] Installing /workspace/source/pom.xml to /home/jenkins/.mvnrepository/org/entando/entando-k8s-cluster-infrastructure-controller/0.0.0-SNAPSHOT-PR-21-2/entando-k8s-cluster-infrastructure-controller-0.0.0-SNAPSHOT-PR-21-2.pom
[INFO] Installing /workspace/source/target/entando-k8s-cluster-infrastructure-controller-0.0.0-SNAPSHOT-PR-21-2-tests.jar to /home/jenkins/.mvnrepository/org/entando/entando-k8s-cluster-infrastructure-controller/0.0.0-SNAPSHOT-PR-21-2/entando-k8s-cluster-infrastructure-controller-0.0.0-SNAPSHOT-PR-21-2-tests.jar
[INFO] Installing /workspace/source/target/entando-k8s-cluster-infrastructure-controller-0.0.0-SNAPSHOT-PR-21-2-javadoc.jar to /home/jenkins/.mvnrepository/org/entando/entando-k8s-cluster-infrastructure-controller/0.0.0-SNAPSHOT-PR-21-2/entando-k8s-cluster-infrastructure-controller-0.0.0-SNAPSHOT-PR-21-2-javadoc.jar
[INFO] 
[INFO] --- maven-deploy-plugin:2.8.2:deploy (default-deploy) @ entando-k8s-cluster-infrastructure-controller ---
[INFO] Using alternate deployment repository local-nexus::default::http://nexus/repository/maven-releases/
[INFO] 
[INFO] -----< org.entando:entando-k8s-cluster-infrastructure-controller >------
[INFO] Building Entando K8S Controller for Entando Cluster Infrastructure Deployments 0.0.0-SNAPSHOT-PR-21-2
[INFO] --------------------------------[ jar ]---------------------------------
[INFO] 
[INFO] --- sonar-maven-plugin:3.8.0.2131:sonar (default-cli) @ entando-k8s-cluster-infrastructure-controller ---
[INFO] User cache: /****/.sonar/cache
[INFO] SonarQube version: 8.5.0
[INFO] Default locale: "en_US", source code encoding: "UTF-8"
[INFO] Load global settings
[INFO] Load global settings (done) | time=246ms
[INFO] Server id: 1BD809FA-AWHW8ct9-T_TB3XqouNu
[INFO] User cache: /****/.sonar/cache
[INFO] Load/download plugins
[INFO] Load plugins index
[INFO] Load plugins index (done) | time=96ms
[INFO] Load/download plugins (done) | time=22705ms
[INFO] Loaded core extensions: developer-scanner
[INFO] JavaScript/TypeScript frontend is enabled
[INFO] Load project settings for component key: 'entando-k8s_entando-k8s-cluster-infrastructure-controller'
[INFO] Load project settings for component key: 'entando-k8s_entando-k8s-cluster-infrastructure-controller' (done) | time=38ms
[INFO] Process project properties
[INFO] E**cute project builders
[INFO] E**cute project builders (done) | time=2ms
[INFO] Project key: entando-k8s_entando-k8s-cluster-infrastructure-controller
[INFO] Base dir: /workspace/source
[INFO] Working dir: /workspace/source/target/sonar
[INFO] Load project branches
[INFO] Load project branches (done) | time=33ms
[INFO] Check ALM binding of project 'entando-k8s_entando-k8s-cluster-infrastructure-controller'
[INFO] Detected project binding: BOUND
[INFO] Check ALM binding of project 'entando-k8s_entando-k8s-cluster-infrastructure-controller' (done) | time=25ms
[INFO] Load project pull requests
[INFO] Load project pull requests (done) | time=46ms
[INFO] Load branch configuration
[INFO] Load branch configuration (done) | time=542ms
[INFO] Load quality profiles
[INFO] Load quality profiles (done) | time=75ms
[INFO] Load active rules
[INFO] Load active rules (done) | time=1320ms
[INFO] Organization key: entando-k8s
[INFO] Pull request 21 for merge into master from ENG-2068-base-image-update
[INFO] SCM collecting changed files in the branch
[WARNING] Exception caught during e**cution of command '[/usr/local/git/bin/git, config, --******, --edit]' in '/usr/local/git/bin', return code '128', error message 'fatal: Invalid path '/usr/local/git/etc': No such file or directory
'
[INFO] SCM collecting changed files in the branch (done) | time=383ms
[INFO] Indexing files...
[INFO] Project configuration:
[INFO] 9 files inde**d
[INFO] 0 files ignored because of scm ignore settings
[INFO] Quality profile for java: Sonar way
[INFO] Quality profile for xml: Sonar way
[INFO] ------------- Run sensors on module Entando K8S Controller for Entando Cluster Infrastructure Deployments
[INFO] JavaScript/TypeScript frontend is enabled
[INFO] Load metrics repository
[INFO] Load metrics repository (done) | time=39ms
[INFO] Sensor JavaSquidSensor [java]
[INFO] Configured Java source version (sonar.java.source): 8
[INFO] JavaClasspath initialization
[INFO] JavaClasspath initialization (done) | time=23ms
[INFO] JavaTestClasspath initialization
[INFO] JavaTestClasspath initialization (done) | time=1ms
[INFO] Java Main Files AST scan
[INFO] 5 source files to be analyzed
[INFO] 5/5 source files have been analyzed
[INFO] Java Main Files AST scan (done) | time=3143ms
[INFO] Java Test Files AST scan
[INFO] 3 source files to be analyzed
[INFO] 3/3 source files have been analyzed
[INFO] Java Test Files AST scan (done) | time=543ms
[INFO] Java Generated Files AST scan
[INFO] 0 source files to be analyzed
[INFO] 0/0 source files have been analyzed
[INFO] Java Generated Files AST scan (done) | time=1ms
[INFO] Sensor JavaSquidSensor [java] (done) | time=4154ms
[INFO] Sensor SonarCSS Rules [cssfamily]
[INFO] No CSS, PHP, HTML or VueJS files are found in the project. CSS analysis is skipped.
[INFO] Sensor SonarCSS Rules [cssfamily] (done) | time=1ms
[INFO] Sensor C# Project Type Information [csharp]
[INFO] Sensor C# Project Type Information [csharp] (done) | time=1ms
[INFO] Sensor C# Properties [csharp]
[INFO] Sensor C# Properties [csharp] (done) | time=1ms
[INFO] Sensor Import of Checkstyle issues [java]
[INFO] Importing /workspace/source/target/checkstyle-result.xml
[INFO] Sensor Import of Checkstyle issues [java] (done) | time=78ms
[INFO] Sensor SurefireSensor [java]
[INFO] parsing [/workspace/source/target/surefire-reports]
[INFO] Sensor SurefireSensor [java] (done) | time=33ms
[INFO] Sensor JavaXmlSensor [java]
[INFO] 1 source file to be analyzed
[INFO] 1/1 source file has been analyzed
[INFO] Sensor JavaXmlSensor [java] (done) | time=215ms
[INFO] Sensor HTML [web]
[INFO] Sensor HTML [web] (done) | time=4ms
[INFO] Sensor XML Sensor [xml]
[INFO] 1 source file to be analyzed
[INFO] 1/1 source file has been analyzed
[INFO] Sensor XML Sensor [xml] (done) | time=208ms
[INFO] Sensor VB.NET Project Type Information [vbnet]
[INFO] Sensor VB.NET Project Type Information [vbnet] (done) | time=2ms
[INFO] Sensor VB.NET Properties [vbnet]
[INFO] Sensor VB.NET Properties [vbnet] (done) | time=2ms
[INFO] Sensor JaCoCo XML Report Importer [jacoco]
[INFO] Importing 1 report(s). Turn your logs in debug mode in order to see the exhaustive list.
[INFO] Sensor JaCoCo XML Report Importer [jacoco] (done) | time=32ms
[INFO] Sensor ThymeLeaf template sensor [securityjavafrontend]
[INFO] Sensor ThymeLeaf template sensor [securityjavafrontend] (done) | time=3ms
[INFO] Sensor JavaSecuritySensor [security]
[INFO] Reading type hierarchy from: /workspace/source/target/sonar/ucfg2/java
[INFO] Read 86 type definitions
[INFO] Reading UCFGs from: /workspace/source/target/sonar/ucfg2/java
[INFO] 13:13:46.303809 Building Runtime Type propagation graph
[INFO] 13:13:46.313285 Running Tarjan on 113 nodes
[INFO] 13:13:46.315534 Tarjan found 113 components
[INFO] 13:13:46.318227 Variable type analysis: done
[INFO] 13:13:46.318786 Building Runtime Type propagation graph
[INFO] 13:13:46.322272 Running Tarjan on 113 nodes
[INFO] 13:13:46.322935 Tarjan found 113 components
[INFO] 13:13:46.323596 Variable type analysis: done
[INFO] Analyzing 38 ucfgs to detect vulnerabilities.
[INFO] All rules entrypoints : 0 Retained UCFGs : 0
[INFO] rule: S5131, entrypoints: 0
[INFO] rule: S5131 done
[INFO] rule: S3649, entrypoints: 0
[INFO] rule: S3649 done
[INFO] rule: S2076, entrypoints: 0
[INFO] rule: S2076 done
[INFO] rule: S2091, entrypoints: 0
[INFO] rule: S2091 done
[INFO] rule: S2078, entrypoints: 0
[INFO] rule: S2078 done
[INFO] rule: S2631, entrypoints: 0
[INFO] rule: S2631 done
[INFO] rule: S5135, entrypoints: 0
[INFO] rule: S5135 done
[INFO] rule: S2083, entrypoints: 0
[INFO] rule: S2083 done
[INFO] rule: S5167, entrypoints: 0
[INFO] rule: S5167 done
[INFO] rule: S5144, entrypoints: 0
[INFO] rule: S5144 done
[INFO] rule: S5145, entrypoints: 0
[INFO] rule: S5145 done
[INFO] rule: S5146, entrypoints: 0
[INFO] rule: S5146 done
[INFO] rule: S5334, entrypoints: 0
[INFO] rule: S5334 done
[INFO] rule: S6096, entrypoints: 0
[INFO] rule: S6096 done
[INFO] Sensor JavaSecuritySensor [security] (done) | time=488ms
[INFO] Sensor CSharpSecuritySensor [security]
[INFO] Reading type hierarchy from: /workspace/source/target/ucfg_cs2
[INFO] Read 0 type definitions
[INFO] Reading UCFGs from: /workspace/source/target/ucfg_cs2
[INFO] No UCFGs have been included for analysis.
[INFO] Sensor CSharpSecuritySensor [security] (done) | time=1ms
[INFO] Sensor PhpSecuritySensor [security]
[INFO] Reading type hierarchy from: /workspace/source/target/sonar/ucfg2/php
[INFO] Read 0 type definitions
[INFO] Reading UCFGs from: /workspace/source/target/sonar/ucfg2/php
[INFO] No UCFGs have been included for analysis.
[INFO] Sensor PhpSecuritySensor [security] (done) | time=1ms
[INFO] Sensor PythonSecuritySensor [security]
[INFO] Reading type hierarchy from: /workspace/source/target/sonar/ucfg2/python
[INFO] Read 0 type definitions
[INFO] Reading UCFGs from: /workspace/source/target/sonar/ucfg2/python
[INFO] No UCFGs have been included for analysis.
[INFO] Sensor PythonSecuritySensor [security] (done) | time=1ms
[INFO] Sensor JsSecuritySensor [security]
[INFO] Reading type hierarchy from: /workspace/source/target/sonar/ucfg2/js
[INFO] Read 0 type definitions
[INFO] Reading UCFGs from: /workspace/source/target/sonar/ucfg2/js
[INFO] No UCFGs have been included for analysis.
[INFO] Sensor JsSecuritySensor [security] (done) | time=1ms
[INFO] ------------- Run sensors on project
[INFO] Sensor Zero Coverage Sensor
[INFO] Sensor Zero Coverage Sensor (done) | time=1ms
[INFO] Sensor Java CPD Block Inde**r
[INFO] Sensor Java CPD Block Inde**r (done) | time=43ms
[INFO] SCM Publisher SCM provider for this project is: git
[INFO] SCM Publisher 1 source file to be analyzed
[INFO] SCM Publisher 0/1 source files have been analyzed (done) | time=104ms
[WARNING] Missing blame information for the following files:
[WARNING]   * pom.xml
[WARNING] This may lead to missing/broken features in SonarCloud
[INFO] CPD E**cutor 1 file had no CPD blocks
[INFO] CPD E**cutor Calculating CPD for 4 files
[INFO] CPD E**cutor CPD calculation finished (done) | time=16ms
[INFO] SCM writing changed lines
[INFO] SCM writing changed lines (done) | time=34ms
[INFO] Analysis report generated in 197ms, dir size=196 KB
[INFO] Analysis report compressed in 17ms, zip size=44 KB
[INFO] Analysis report uploaded in 93ms
[INFO] ANALYSIS SUCCESSFUL, you can find the results at: https://sonarcloud.io/dashboard?id=entando-k8s_entando-k8s-cluster-infrastructure-controller&pullRequest=21
[INFO] Note that you will be able to access the updated dashboard once the server has processed the submitted analysis report
[INFO] More about the report processing at https://sonarcloud.io/api/ce/task?id=AXhuq1syFiMQUvaH3z2p
[INFO] Analysis total time: 11.714 s
[INFO] ------------------------------------------------------------------------
[INFO] BUILD SUCCESS
[INFO] ------------------------------------------------------------------------
[INFO] Total time:  01:30 min
[INFO] Finished at: 2021-03-26T13:13:47Z
[INFO] ------------------------------------------------------------------------
Picked up _JAVA_OPTIONS: -XX:+UnlockExperimentalVMOptions -Dsun.zip.disableMemoryMapping=**** -XX:+UseParallelGC -XX:MinHeapFreeRatio=5 -XX:MaxHeapFreeRatio=10 -XX:GCTimeRatio=4 -XX:AdaptiveSizePolicyWeight=90 -Xms1000m -Xmx12000m
[INFO] Scanning for projects...
[INFO] 
[INFO] -----< org.entando:entando-k8s-cluster-infrastructure-controller >------
[INFO] Building Entando K8S Controller for Entando Cluster Infrastructure Deployments 0.0.0-SNAPSHOT-PR-21-2
[INFO] --------------------------------[ jar ]---------------------------------
[INFO] 
[INFO] --- maven-site-plugin:3.9.0:site (default-site) @ entando-k8s-cluster-infrastructure-controller ---
[INFO] configuring report plugin org.apache.maven.plugins:maven-project-info-reports-plugin:3.0.0
[INFO] 9 reports configured for maven-project-info-reports-plugin:3.0.0: dependency-info, distribution-management, index, ci-management, issue-management, licenses, plugins, scm, summary
[INFO] Rendering site with default locale English (en)
[WARNING] Unable to find a URL to the parent project. The parent menu will NOT be added.
[INFO] Relativizing decoration links with respect to localized project URL: https://central.entando.com
[INFO] Rendering content with org.apache.maven.skins:maven-default-skin:jar:1.3 skin.
[INFO] Generating "Dependency Information" report --- maven-project-info-reports-plugin:3.0.0:dependency-info
[INFO] Generating "About" report         --- maven-project-info-reports-plugin:3.0.0:index
[INFO] Generating "Issue Management" report --- maven-project-info-reports-plugin:3.0.0:issue-management
[INFO] Generating "Licenses" report      --- maven-project-info-reports-plugin:3.0.0:licenses
[INFO] Generating "Plugins" report       --- maven-project-info-reports-plugin:3.0.0:plugins
[INFO] Generating "Source Code Management" report --- maven-project-info-reports-plugin:3.0.0:scm
[INFO] Generating "Summary" report       --- maven-project-info-reports-plugin:3.0.0:summary
[INFO] ------------------------------------------------------------------------
[INFO] BUILD SUCCESS
[INFO] ------------------------------------------------------------------------
[INFO] Total time:  7.873 s
[INFO] Finished at: 2021-03-26T13:13:57Z
[INFO] ------------------------------------------------------------------------
error: etcdserver: request is too large
Congratulations! No build failures found for entando-k8s-cluster-infrastructure-controller-PR-21.

Showing logs for build [32mentando-k8s-entando-k8s-cluster-9btr7-2[0m stage [32mfrom-build-pack[0m and container [32mstep-build-container-build[0m
Generating tags...
 - entando/entando-k8s-cluster-infrastructure-controller -> docker.io/entando/entando-k8s-cluster-infrastructure-controller:0.0.0-SNAPSHOT-PR-21-2
Checking cache...
 - entando/entando-k8s-cluster-infrastructure-controller: Not found. Building
Building [entando/entando-k8s-cluster-infrastructure-controller]...
Sending build context to Docker daemon  146.9kB
Step 1/7 : FROM entando/entando-k8s-operator-common:6.3.13
 ---> f7f2f1cc87d1
Step 2/7 : ARG VERSION
 ---> Using cache
 ---> 4ae5ade3f019
Step 3/7 : LABEL name "Entando K8S Cluster Infrastructure Controller" vendor "Entando" version "v${VERSION}" release "6" summary "This container processes the EntandoClusterInfrastructure custom resource and deploys the Entando K8S Service." description "This is a run-to-completion container. It processes new EntandoClusterInfrastructure Custom                    Resources and deploys an instance of the Entando K8S Service                    to your cluster. This Entando K8S Service will be  configured to use a previously installed Keycloak Server.                    Subsequent e**cutions of this container against the same EntandoClusterInfrastructure will patch the existing                    deployment resources"
 ---> Running in 206f9e09d94b
 ---> ed528bc9da88
Step 4/7 : ENV JAVA_OPTIONS "-Djava.util.logging.manager=org.jboss.logmanager.LogManager"
 ---> Running in 3c4b1a1a108c
 ---> 7860fcd44866
Step 5/7 : ENV AB_ENABLED jmx_exporter
 ---> Running in 88b50210dd98
 ---> c291498d27e7
Step 6/7 : COPY target/*-runner.jar /deployments/app.jar
 ---> 32b5a15b4025
Step 7/7 : ENTRYPOINT /deployments/run-java.sh
 ---> Running in d325dc07c24c
 ---> 50e577a96dc4
Successfully built 50e577a96dc4
The push refers to a repository [docker.io/entando/entando-k8s-cluster-infrastructure-controller]
7bb15955931b: Preparing
69f832c3e34c: Preparing
d183ae916623: Preparing
c73c441dc85b: Preparing
f0a25ae36dcc: Preparing
04a05557bbad: Preparing
821b0c400fe6: Preparing
821b0c400fe6: Waiting
04a05557bbad: Waiting
f0a25ae36dcc: Layer already exists
c73c441dc85b: Mounted from entando/entando-k8s-keycloak-controller
69f832c3e34c: Mounted from entando/entando-k8s-keycloak-controller
04a05557bbad: Layer already exists
d183ae916623: Mounted from entando/entando-k8s-keycloak-controller
821b0c400fe6: Layer already exists
7bb15955931b: Pushed
0.0.0-SNAPSHOT-PR-21-2: digest: sha256:a37e6f5ef1fd31a4ae6c71f9f827cf9ddb474c7d584aacec3d7bef3d520ecbe3 size: 1792
There is a new version (1.21.0) of Skaffold available. Download it at https://storage.googleapis.com/skaffold/releases/latest/skaffold-linux-amd64


Showing logs for build [32mentando-k8s-entando-k8s-cluster-9btr7-2[0m stage [32mfrom-build-pack[0m and container [32mstep-postbuild-post-build[0m
no CVE provider running in the current ** namespace so skip adding image to be analysed

Showing logs for build [32mentando-k8s-entando-k8s-cluster-9btr7-2[0m stage [32mfrom-build-pack[0m and container [32mstep-promote-make-preview[0m
Creating /builder/home/.helm 
Creating /builder/home/.helm/repository 
Creating /builder/home/.helm/repository/cache 
Creating /builder/home/.helm/repository/local 
Creating /builder/home/.helm/plugins 
Creating /builder/home/.helm/starters 
Creating /builder/home/.helm/cache/archive 
Creating /builder/home/.helm/repository/repositories.yaml 
Adding stable repo with URL: https://charts.helm.sh/stable 
Adding local repo with URL: http://127.0.0.1:8879/charts 
$HELM_HOME has been configured at /builder/home/.helm.
Not installing Tiller due to 'client-only' flag having been set
sed -i -e "s/version:.*/version: 0.0.0-SNAPSHOT-PR-21-2/" Chart.yaml
sed -i -e "s/version:.*/version: 0.0.0-SNAPSHOT-PR-21-2/" ../*/Chart.yaml
sed -i -e "s|repository:.*|repository: docker.io\/entando\/entando-k8s-cluster-infrastructure-controller|" values.yaml
sed -i -e "s/tag:.*/tag: 0.0.0-SNAPSHOT-PR-21-2/" values.yaml
echo "  version: 0.0.0-SNAPSHOT-PR-21-2" >> requirements.yaml
** step helm build
WARNING: No $CHART_REPOSITORY defined so using the default value of: http://jenkins-x-chartmuseum:8080
Adding missing Helm repo: storage.googleapis.com https://storage.googleapis.com/chartmuseum.jenkins-x.io
Successfully added Helm repository storage.googleapis.com.
Adding missing Helm repo: jenkins-x-chartmuseum http://jenkins-x-chartmuseum:8080
Successfully added Helm repository jenkins-x-chartmuseum.
WARNING: No $CHART_REPOSITORY defined so using the default value of: http://jenkins-x-chartmuseum:8080

Showing logs for build [32mentando-k8s-entando-k8s-cluster-9btr7-2[0m stage [32mfrom-build-pack[0m and container [32mstep-promote-jx-preview[0m
Creating a preview
Found commit author match for: joewhite101 with email address: j.white@entando.com
Created environment entando-k8s-cluster-infrastructure-controller-cipr21
Namespace entando-k8s-cluster-infrastructure-controller-cipr21 created 
expose:
  Annotations:
    helm.sh/hook: post-install,post-upgrade
    helm.sh/hook-delete-policy: hook-succeeded
  config:
    domain: *************
    exposer: Ingress
    http: "****"
preview:
  image:
    repository: docker.io/entando/entando-k8s-cluster-infrastructure-controller
    tag: 0.0.0-SNAPSHOT-PR-21-2

WARNING: Could not find the service URL in namespace entando-k8s-cluster-infrastructure-controller-cipr21 for names : Timed out after 1m0s, last error: %!s(<nil>)
Updating PipelineActivities entando-k8s-entando-k8s-cluster-infrastructure-controller-pr-21-2 which has status Running
WARNING: Failed to find the service entando-k8s-cluster-infrastructure-controller : failed to find service entando-k8s-cluster-infrastructure-controller in namespace entando-k8s-cluster-infrastructure-controller-cipr21: services "entando-k8s-cluster-infrastructure-controller" not found

Showing logs for build [32mentando-k8s-entando-k8s-cluster-9btr7-2[0m stage [32mfrom-build-pack[0m and container [32mstep-promote-run-post-deployment-tests[0m
Picked up _JAVA_OPTIONS: -XX:+UnlockExperimentalVMOptions -Dsun.zip.disableMemoryMapping=**** -XX:+UseParallelGC -XX:MinHeapFreeRatio=5 -XX:MaxHeapFreeRatio=10 -XX:GCTimeRatio=4 -XX:AdaptiveSizePolicyWeight=90 -Xms1000m -Xmx12000m
[INFO] Scanning for projects...
[INFO] 
[INFO] -----< org.entando:entando-k8s-cluster-infrastructure-controller >------
[INFO] Building Entando K8S Controller for Entando Cluster Infrastructure Deployments 0.0.0-SNAPSHOT-PR-21-2
[INFO] --------------------------------[ jar ]---------------------------------
[INFO] 
[INFO] --- maven-resources-plugin:2.6:resources (default-resources) @ entando-k8s-cluster-infrastructure-controller ---
[INFO] Using 'UTF-8' encoding to copy filtered resources.
[INFO] Copying 3 resources
[INFO] 
[INFO] --- maven-compiler-plugin:3.8.1:compile (default-compile) @ entando-k8s-cluster-infrastructure-controller ---
[INFO] Nothing to compile - all classes are up to date
[INFO] 
[INFO] --- maven-resources-plugin:2.6:testResources (default-testResources) @ entando-k8s-cluster-infrastructure-controller ---
[INFO] Using 'UTF-8' encoding to copy filtered resources.
[INFO] Copying 3 resources
[INFO] 
[INFO] --- maven-compiler-plugin:3.8.1:testCompile (default-testCompile) @ entando-k8s-cluster-infrastructure-controller ---
[INFO] Nothing to compile - all classes are up to date
[INFO] 
[INFO] --- maven-surefire-plugin:3.0.0-M1:test (default-test) @ entando-k8s-cluster-infrastructure-controller ---
[INFO] Tests are skipped.
[INFO] 
[INFO] --- maven-jar-plugin:3.2.0:jar (default-jar) @ entando-k8s-cluster-infrastructure-controller ---
[INFO] 
[INFO] --- maven-jar-plugin:3.2.0:test-jar (build-test-jar) @ entando-k8s-cluster-infrastructure-controller ---
[INFO] 
[INFO] --- maven-failsafe-plugin:3.0.0-M4:integration-test (run-tests) @ entando-k8s-cluster-infrastructure-controller ---
[INFO] 
[INFO] -------------------------------------------------------
[INFO]  T E S T S
[INFO] -------------------------------------------------------
[INFO] Running org.entando.kubernetes.controller.clusterinfrastructure.interprocesstests.AddClusterInfrastructureIT
Mar 26, 2021 1:16:31 PM org.entando.kubernetes.client.KubernetesRestInterceptor invoke
INFO: Entering method loadDockerImageInfoConfigMap in class org.entando.kubernetes.controller.support.client.EntandoResourceClient
Mar 26, 2021 1:16:31 PM org.entando.kubernetes.client.KubernetesRestInterceptor invoke
INFO: Exiting method loadDockerImageInfoConfigMap in class org.entando.kubernetes.controller.support.client.EntandoResourceClient
Mar 26, 2021 1:16:33 PM org.entando.kubernetes.client.integrationtesthelpers.DeletionWaiter lambda$deleteSingleItem$2
WARNING: Deleting pods  entando-k8s-cluster-infrastructure-controller-cipr21/pg-test
Mar 26, 2021 1:16:33 PM org.entando.kubernetes.client.KubernetesRestInterceptor invoke
INFO: Entering method loadDockerImageInfoConfigMap in class org.entando.kubernetes.controller.support.client.EntandoResourceClient
Mar 26, 2021 1:16:33 PM org.entando.kubernetes.client.KubernetesRestInterceptor invoke
INFO: Exiting method loadDockerImageInfoConfigMap in class org.entando.kubernetes.controller.support.client.EntandoResourceClient
!!!!!!!On EntandoClusterInfrastructure add!!!!!!!!!
Mar 26, 2021 1:16:34 PM org.entando.kubernetes.client.KubernetesRestInterceptor invoke
INFO: Entering method removeAndWait in class org.entando.kubernetes.controller.support.client.PodClient with entando-k8s-cluster-infrastructure-controller-cipr21,{EntandoResourceNamespace=entando-k8s-cluster-infrastructure-controller-cipr21, EntandoClusterInfrastructure=eti-cipr21, EntandoResourceKind=EntandoClusterInfrastructure}
Mar 26, 2021 1:16:34 PM org.entando.kubernetes.client.KubernetesRestInterceptor invoke
INFO: Exiting method removeAndWait in class org.entando.kubernetes.controller.support.client.PodClient
Mar 26, 2021 1:16:34 PM org.entando.kubernetes.client.KubernetesRestInterceptor invoke
INFO: Entering method start in class org.entando.kubernetes.controller.support.client.PodClient with Pod: entando-k8s-cluster-infrastructure-controller-cipr21/eti-cipr21-deployer-4477
Mar 26, 2021 1:16:34 PM org.entando.kubernetes.client.KubernetesRestInterceptor invoke
INFO: Exiting method start in class org.entando.kubernetes.controller.support.client.PodClient
ADDED:PodStatus(conditions=[PodCondition(lastProbeTime=null, lastTransitionTime=2021-03-26T13:16:50Z, message=null, reason=null, status=True, type=PodScheduled, additionalProperties={})], containerStatuses=[], ephemeralContainerStatuses=[], hostIP=null, initContainerStatuses=[], message=null, nominatedNodeName=null, phase=Pending, podIP=null, podIPs=[], qosClass=Burstable, reason=null, startTime=null, additionalProperties={})
MODIFIED:PodStatus(conditions=[PodCondition(lastProbeTime=null, lastTransitionTime=2021-03-26T13:16:50Z, message=null, reason=null, status=True, type=Initialized, additionalProperties={}), PodCondition(lastProbeTime=null, lastTransitionTime=2021-03-26T13:16:50Z, message=containers with unready status: [k8s-svc-container], reason=ContainersNotReady, status=False, type=Ready, additionalProperties={}), PodCondition(lastProbeTime=null, lastTransitionTime=null, message=containers with unready status: [k8s-svc-container], reason=ContainersNotReady, status=False, type=ContainersReady, additionalProperties={}), PodCondition(lastProbeTime=null, lastTransitionTime=2021-03-26T13:16:50Z, message=null, reason=null, status=True, type=PodScheduled, additionalProperties={})], containerStatuses=[ContainerStatus(containerID=null, image=entando/entando-k8s-service@sha256:f0280ee845571eac1f5b673a67ba757b87e5eac7ca743daab7f3e4f1ac54a1b6, imageID=, lastState=ContainerState(running=null, terminated=null, waiting=null, additionalProperties={}), name=k8s-svc-container, ready=false, restartCount=0, started=null, state=ContainerState(running=null, terminated=null, waiting=ContainerStateWaiting(message=null, reason=ContainerCreating, additionalProperties={}), additionalProperties={}), additionalProperties={})], ephemeralContainerStatuses=[], hostIP=54.36.53.206, initContainerStatuses=[], message=null, nominatedNodeName=null, phase=Pending, podIP=null, podIPs=[], qosClass=Burstable, reason=null, startTime=2021-03-26T13:16:50Z, additionalProperties={})
MODIFIED:PodStatus(conditions=[PodCondition(lastProbeTime=null, lastTransitionTime=2021-03-26T13:16:50Z, message=null, reason=null, status=True, type=Initialized, additionalProperties={}), PodCondition(lastProbeTime=null, lastTransitionTime=2021-03-26T13:16:50Z, message=containers with unready status: [k8s-svc-container], reason=ContainersNotReady, status=False, type=Ready, additionalProperties={}), PodCondition(lastProbeTime=null, lastTransitionTime=null, message=containers with unready status: [k8s-svc-container], reason=ContainersNotReady, status=False, type=ContainersReady, additionalProperties={}), PodCondition(lastProbeTime=null, lastTransitionTime=2021-03-26T13:16:50Z, message=null, reason=null, status=True, type=PodScheduled, additionalProperties={})], containerStatuses=[ContainerStatus(containerID=docker://97886c06df5e8666de5b56da6f0c67784f276d4a2aa30c3342dbaa813bdd5d31, image=docker.io/entando/entando-k8s-service@sha256:f0280ee845571eac1f5b673a67ba757b87e5eac7ca743daab7f3e4f1ac54a1b6, imageID=docker-pullable://docker.io/entando/entando-k8s-service@sha256:f0280ee845571eac1f5b673a67ba757b87e5eac7ca743daab7f3e4f1ac54a1b6, lastState=ContainerState(running=null, terminated=null, waiting=null, additionalProperties={}), name=k8s-svc-container, ready=false, restartCount=0, started=null, state=ContainerState(running=ContainerStateRunning(startedAt=2021-03-26T13:16:58Z, additionalProperties={}), terminated=null, waiting=null, additionalProperties={}), additionalProperties={})], ephemeralContainerStatuses=[], hostIP=54.36.53.206, initContainerStatuses=[], message=null, nominatedNodeName=null, phase=Running, podIP=10.128.1.185, podIPs=[], qosClass=Burstable, reason=null, startTime=2021-03-26T13:16:50Z, additionalProperties={})
MODIFIED:PodStatus(conditions=[PodCondition(lastProbeTime=null, lastTransitionTime=2021-03-26T13:16:50Z, message=null, reason=null, status=True, type=Initialized, additionalProperties={}), PodCondition(lastProbeTime=null, lastTransitionTime=2021-03-26T13:17:52Z, message=null, reason=null, status=True, type=Ready, additionalProperties={}), PodCondition(lastProbeTime=null, lastTransitionTime=null, message=null, reason=null, status=True, type=ContainersReady, additionalProperties={}), PodCondition(lastProbeTime=null, lastTransitionTime=2021-03-26T13:16:50Z, message=null, reason=null, status=True, type=PodScheduled, additionalProperties={})], containerStatuses=[ContainerStatus(containerID=docker://97886c06df5e8666de5b56da6f0c67784f276d4a2aa30c3342dbaa813bdd5d31, image=docker.io/entando/entando-k8s-service@sha256:f0280ee845571eac1f5b673a67ba757b87e5eac7ca743daab7f3e4f1ac54a1b6, imageID=docker-pullable://docker.io/entando/entando-k8s-service@sha256:f0280ee845571eac1f5b673a67ba757b87e5eac7ca743daab7f3e4f1ac54a1b6, lastState=ContainerState(running=null, terminated=null, waiting=null, additionalProperties={}), name=k8s-svc-container, ready=****, restartCount=0, started=null, state=ContainerState(running=ContainerStateRunning(startedAt=2021-03-26T13:16:58Z, additionalProperties={}), terminated=null, waiting=null, additionalProperties={}), additionalProperties={})], ephemeralContainerStatuses=[], hostIP=54.36.53.206, initContainerStatuses=[], message=null, nominatedNodeName=null, phase=Running, podIP=10.128.1.185, podIPs=[], qosClass=Burstable, reason=null, startTime=2021-03-26T13:16:50Z, additionalProperties={})
Finished: eti-cipr21-k8s-svc-deployment-8455bdc4bc-rfc67
200:null
[INFO] Tests run: 1, Failures: 0, Errors: 0, Skipped: 0, Time elapsed: 83.913 s - in org.entando.kubernetes.controller.clusterinfrastructure.interprocesstests.AddClusterInfrastructureIT
[INFO] 
[INFO] Results:
[INFO] 
[INFO] Tests run: 1, Failures: 0, Errors: 0, Skipped: 0
[INFO] 
[INFO] 
[INFO] --- maven-surefire-report-plugin:3.0.0-M4:failsafe-report-only (integration-tests) @ entando-k8s-cluster-infrastructure-controller ---
[WARNING] Unable to locate Test Source XRef to link to - DISABLED
[INFO] 
[INFO] --- maven-surefire-report-plugin:3.0.0-M4:report-only (unit-tests) @ entando-k8s-cluster-infrastructure-controller ---
[WARNING] Unable to locate Test Source XRef to link to - DISABLED
[INFO] 
[INFO] --- maven-failsafe-plugin:3.0.0-M4:verify (run-tests) @ entando-k8s-cluster-infrastructure-controller ---
[INFO] 
[INFO] --- maven-site-plugin:3.9.0:site (default-site) @ entando-k8s-cluster-infrastructure-controller ---
[INFO] configuring report plugin org.apache.maven.plugins:maven-project-info-reports-plugin:3.0.0
[INFO] 9 reports configured for maven-project-info-reports-plugin:3.0.0: dependency-info, distribution-management, index, ci-management, issue-management, licenses, plugins, scm, summary
[INFO] Rendering site with default locale English (en)
[WARNING] Unable to find a URL to the parent project. The parent menu will NOT be added.
[INFO] Relativizing decoration links with respect to localized project URL: https://central.entando.com
[INFO] Rendering content with org.apache.maven.skins:maven-default-skin:jar:1.3 skin.
[INFO] Generating "Dependency Information" report --- maven-project-info-reports-plugin:3.0.0:dependency-info
[INFO] Generating "About" report         --- maven-project-info-reports-plugin:3.0.0:index
[INFO] Generating "Issue Management" report --- maven-project-info-reports-plugin:3.0.0:issue-management
[INFO] Generating "Licenses" report      --- maven-project-info-reports-plugin:3.0.0:licenses
[INFO] Generating "Plugins" report       --- maven-project-info-reports-plugin:3.0.0:plugins
[INFO] Generating "Source Code Management" report --- maven-project-info-reports-plugin:3.0.0:scm
[INFO] Generating "Summary" report       --- maven-project-info-reports-plugin:3.0.0:summary
[INFO] ------------------------------------------------------------------------
[INFO] BUILD SUCCESS
[INFO] ------------------------------------------------------------------------
[INFO] Total time:  01:33 min
[INFO] Finished at: 2021-03-26T13:17:57Z
[INFO] ------------------------------------------------------------------------
error: etcdserver: request is too large
