
Showing logs for build [32mentando-k8s-entando-k8s-keycloa-qj9bv-1[0m stage [32mfrom-build-pack[0m and container [32mstep-credential-initializer-p46z5[0m
{"level":"warn","ts":1614757888.741084,"logger":"fallback-logger","caller":"logging/config.go:69","msg":"Fetch GitHub commit ID from kodata failed: \"ref: refs/heads/0.8.0-**-support-backwards-incompats\" is not a valid GitHub commit ID"}
{"level":"info","ts":1614757888.750272,"logger":"fallback-logger","caller":"creds-init/main.go:40","msg":"Credentials initialized."}

Showing logs for build [32mentando-k8s-entando-k8s-keycloa-qj9bv-1[0m stage [32mfrom-build-pack[0m and container [32mstep-working-dir-initializer-6m5lx[0m
{"level":"warn","ts":1614757890.3833432,"logger":"fallback-logger","caller":"logging/config.go:69","msg":"Fetch GitHub commit ID from kodata failed: open /var/run/ko/HEAD: no such file or directory"}
{"level":"info","ts":1614757890.3975325,"logger":"fallback-logger","caller":"bash/main.go:64","msg":"Successfully e**cuted command \"sh -c mkdir -p /workspace/source\"; output "}

Showing logs for build [32mentando-k8s-entando-k8s-keycloa-qj9bv-1[0m stage [32mfrom-build-pack[0m and container [32mstep-place-tools[0m

Showing logs for build [32mentando-k8s-entando-k8s-keycloa-qj9bv-1[0m stage [32mfrom-build-pack[0m and container [32mstep-git-source-entando-k8s-entando-k8s-keycloa-8bhn5[0m
{"level":"warn","ts":1614757927.505071,"logger":"fallback-logger","caller":"logging/config.go:69","msg":"Fetch GitHub commit ID from kodata failed: \"ref: refs/heads/0.8.0-**-support-backwards-incompats\" is not a valid GitHub commit ID"}
{"level":"info","ts":1614757928.2634776,"logger":"fallback-logger","caller":"git/git.go:103","msg":"Successfully cloned https://github.com/entando-k8s/entando-k8s-keycloak-controller.git @ master in path /workspace/source"}

Showing logs for build [32mentando-k8s-entando-k8s-keycloa-qj9bv-1[0m stage [32mfrom-build-pack[0m and container [32mstep-git-merge[0m
Using SHAs from PULL_REFS=master:01f34458abab4ab9da5c2de30ca3cdd78fc46a56,24:2ffd52d5e658a5e3d5406786086e36dce141437a
DEBUG: ran git fetch --unshallow origin 2ffd52d5e658a5e3d5406786086e36dce141437a: 01f34458abab4ab9da5c2de30ca3cdd78fc46a56: in 
DEBUG: ran git checkout master in 
DEBUG: ran git reset --hard 01f34458abab4ab9da5c2de30ca3cdd78fc46a56 in 
DEBUG: ran clean --force -d . in 
DEBUG: ran git merge 2ffd52d5e658a5e3d5406786086e36dce141437a in 
Merged SHA 2ffd52d5e658a5e3d5406786086e36dce141437a with commit message 'ENG-1876 mounting CA secret directly' into base branch master

Showing logs for build [32mentando-k8s-entando-k8s-keycloa-qj9bv-1[0m stage [32mfrom-build-pack[0m and container [32mstep-build-set-version[0m
Picked up _JAVA_OPTIONS: -XX:+UnlockExperimentalVMOptions -Dsun.zip.disableMemoryMapping=**** -XX:+UseParallelGC -XX:MinHeapFreeRatio=5 -XX:MaxHeapFreeRatio=10 -XX:GCTimeRatio=4 -XX:AdaptiveSizePolicyWeight=90 -Xms1000m -Xmx12000m
[INFO] Scanning for projects...
[INFO] 
[INFO] ------------< org.entando:entando-k8s-keycloak-controller >-------------
[INFO] Building Entando K8S Controller for Keycloak 6.3.0-SNAPSHOT
[INFO] --------------------------------[ jar ]---------------------------------
[INFO] 
[INFO] --- versions-maven-plugin:2.8.1:set (default-cli) @ entando-k8s-keycloak-controller ---
[INFO] Local aggregation ****: /workspace/source
[INFO] Processing change of org.entando:entando-k8s-keycloak-controller:6.3.0-SNAPSHOT -> 0.0.0-SNAPSHOT-PR-24-1
[INFO] Processing org.entando:entando-k8s-keycloak-controller
[INFO]     Updating project org.entando:entando-k8s-keycloak-controller
[INFO]         from version 6.3.0-SNAPSHOT to 0.0.0-SNAPSHOT-PR-24-1
[INFO] 
[INFO] ------------------------------------------------------------------------
[INFO] BUILD SUCCESS
[INFO] ------------------------------------------------------------------------
[INFO] Total time:  10.225 s
[INFO] Finished at: 2021-03-03T07:52:22Z
[INFO] ------------------------------------------------------------------------

Showing logs for build [32mentando-k8s-entando-k8s-keycloa-qj9bv-1[0m stage [32mfrom-build-pack[0m and container [32mstep-build-fix-git-for-sonar[0m
Switched to a new branch 'PR-24'
M	pom.xml
Deleted branch master (was 2ffd52d).
From https://github.com/entando-k8s/entando-k8s-keycloak-controller
 * [new branch]      master     -> master
 * [new tag]         v6.0.24    -> v6.0.24
 * [new tag]         v6.0.31    -> v6.0.31

Showing logs for build [32mentando-k8s-entando-k8s-keycloa-qj9bv-1[0m stage [32mfrom-build-pack[0m and container [32mstep-build-mvn-verify-pr[0m
Picked up _JAVA_OPTIONS: -XX:+UnlockExperimentalVMOptions -Dsun.zip.disableMemoryMapping=**** -XX:+UseParallelGC -XX:MinHeapFreeRatio=5 -XX:MaxHeapFreeRatio=10 -XX:GCTimeRatio=4 -XX:AdaptiveSizePolicyWeight=90 -Xms1000m -Xmx12000m
[INFO] Scanning for projects...
[INFO] 
[INFO] ------------< org.entando:entando-k8s-keycloak-controller >-------------
[INFO] Building Entando K8S Controller for Keycloak 0.0.0-SNAPSHOT-PR-24-1
[INFO] --------------------------------[ jar ]---------------------------------
[INFO] 
[INFO] --- maven-checkstyle-plugin:3.1.1:check (validate) @ entando-k8s-keycloak-controller ---
[INFO] Starting audit...
Audit done.
[INFO] You have 0 Checkstyle violations.
[INFO] 
[INFO] --- maven-checkstyle-plugin:3.1.1:checkstyle (validate) @ entando-k8s-keycloak-controller ---
[INFO] Starting audit...
Audit done.
[INFO] 
[INFO] --- jacoco-maven-plugin:0.8.5:prepare-agent (prepare-agent) @ entando-k8s-keycloak-controller ---
[INFO] argLine set to -javaagent:/home/jenkins/.mvnrepository/org/jacoco/org.jacoco.agent/0.8.5/org.jacoco.agent-0.8.5-runtime.jar=destfile=/workspace/source/target/jacoco.e**c
[INFO] 
[INFO] --- maven-resources-plugin:2.6:resources (default-resources) @ entando-k8s-keycloak-controller ---
[INFO] Using 'UTF-8' encoding to copy filtered resources.
[INFO] Copying 4 resources
[INFO] 
[INFO] --- maven-compiler-plugin:3.8.1:compile (default-compile) @ entando-k8s-keycloak-controller ---
[INFO] Changes detected - recompiling the module!
[INFO] Compiling 5 source files to /workspace/source/target/classes
[INFO] 
[INFO] --- maven-resources-plugin:2.6:testResources (default-testResources) @ entando-k8s-keycloak-controller ---
[INFO] Using 'UTF-8' encoding to copy filtered resources.
[INFO] Copying 6 resources
[INFO] 
[INFO] --- maven-compiler-plugin:3.8.1:testCompile (default-testCompile) @ entando-k8s-keycloak-controller ---
[INFO] Changes detected - recompiling the module!
[INFO] Compiling 7 source files to /workspace/source/target/test-classes
[INFO] 
[INFO] --- maven-surefire-plugin:3.0.0-M1:test (default-test) @ entando-k8s-keycloak-controller ---
[INFO] 
[INFO] -------------------------------------------------------
[INFO]  T E S T S
[INFO] -------------------------------------------------------
[INFO] Running org.entando.kubernetes.controller.keycloakserver.inprocesstests.DeployKeycloakOnExternalDatabaseTest
Mar 03, 2021 7:52:52 AM org.entando.kubernetes.controller.keycloakserver.EntandoKeycloakServerController ensureKeycloakRealm
SEVERE: Attempting to log into Keycloak at http://my-keycloak-server-service.my-keycloak-namespace.svc.cluster.local:8080/auth
Mar 03, 2021 7:52:53 AM org.entando.kubernetes.controller.keycloakserver.EntandoKeycloakServerController ensureKeycloakRealm
SEVERE: Attempting to log into Keycloak at http://my-keycloak-server-service.my-keycloak-namespace.svc.cluster.local:8080/auth
[INFO] Tests run: 2, Failures: 0, Errors: 0, Skipped: 0, Time elapsed: 4.251 s - in org.entando.kubernetes.controller.keycloakserver.inprocesstests.DeployKeycloakOnExternalDatabaseTest
[INFO] Running org.entando.kubernetes.controller.keycloakserver.inprocesstests.DeployKeycloakServiceTest
Mar 03, 2021 7:52:53 AM org.entando.kubernetes.controller.keycloakserver.EntandoKeycloakServerController ensureKeycloakRealm
SEVERE: Attempting to log into Keycloak at http://my-keycloak-server-service.my-keycloak-namespace.svc.cluster.local:8080/auth
Mar 03, 2021 7:52:54 AM org.entando.kubernetes.controller.keycloakserver.EntandoKeycloakServerController ensureKeycloakRealm
SEVERE: Attempting to log into Keycloak at http://my-keycloak-server-service.my-keycloak-namespace.svc.cluster.local:8080/auth
Mar 03, 2021 7:52:55 AM org.entando.kubernetes.controller.keycloakserver.EntandoKeycloakServerController ensureKeycloakRealm
SEVERE: Attempting to log into Keycloak at http://my-keycloak-server-service.my-keycloak-namespace.svc.cluster.local:8080/auth
Mar 03, 2021 7:52:56 AM org.entando.kubernetes.controller.keycloakserver.EntandoKeycloakServerController ensureKeycloakRealm
SEVERE: Attempting to log into Keycloak at http://my-keycloak-server-service.my-keycloak-namespace.svc.cluster.local:8080/auth
Mar 03, 2021 7:52:57 AM org.entando.kubernetes.controller.keycloakserver.EntandoKeycloakServerController ensureKeycloakRealm
SEVERE: Attempting to log into Keycloak at http://my-keycloak-server-service.my-keycloak-namespace.svc.cluster.local:8080/auth
Mar 03, 2021 7:52:57 AM org.entando.kubernetes.controller.keycloakserver.EntandoKeycloakServerController ensureKeycloakRealm
SEVERE: Attempting to log into Keycloak at http://my-keycloak-server-service.my-keycloak-namespace.svc.cluster.local:8080/auth
Mar 03, 2021 7:52:58 AM org.entando.kubernetes.controller.keycloakserver.EntandoKeycloakServerController ensureKeycloakRealm
SEVERE: Attempting to log into Keycloak at http://my-keycloak-server-service.my-keycloak-namespace.svc.cluster.local:8080/auth
Mar 03, 2021 7:52:59 AM org.entando.kubernetes.controller.keycloakserver.EntandoKeycloakServerController ensureKeycloakRealm
SEVERE: Attempting to log into Keycloak at http://my-keycloak-server-service.my-keycloak-namespace.svc.cluster.local:8080/auth
[INFO] Tests run: 8, Failures: 0, Errors: 0, Skipped: 0, Time elapsed: 6.127 s - in org.entando.kubernetes.controller.keycloakserver.inprocesstests.DeployKeycloakServiceTest
[INFO] Running org.entando.kubernetes.controller.keycloakserver.inprocesstests.DeployKeycloakWithContainerizedDatabaseTest
Mar 03, 2021 7:53:00 AM org.entando.kubernetes.controller.keycloakserver.EntandoKeycloakServerController ensureKeycloakRealm
SEVERE: Attempting to log into Keycloak at http://my-keycloak-server-service.my-keycloak-namespace.svc.cluster.local:8080/auth
Mar 03, 2021 7:53:00 AM org.entando.kubernetes.controller.keycloakserver.EntandoKeycloakServerController ensureKeycloakRealm
SEVERE: Attempting to log into Keycloak at http://my-keycloak-server-service.my-keycloak-namespace.svc.cluster.local:8080/auth
[INFO] Tests run: 2, Failures: 0, Errors: 0, Skipped: 0, Time elapsed: 1.127 s - in org.entando.kubernetes.controller.keycloakserver.inprocesstests.DeployKeycloakWithContainerizedDatabaseTest
[INFO] 
[INFO] Results:
[INFO] 
[INFO] Tests run: 12, Failures: 0, Errors: 0, Skipped: 0
[INFO] 
[INFO] 
[INFO] --- maven-jar-plugin:3.2.0:jar (default-jar) @ entando-k8s-keycloak-controller ---
[INFO] Building jar: /workspace/source/target/entando-k8s-keycloak-controller-0.0.0-SNAPSHOT-PR-24-1.jar
[INFO] 
[INFO] --- maven-jar-plugin:3.2.0:test-jar (build-test-jar) @ entando-k8s-keycloak-controller ---
[INFO] Building jar: /workspace/source/target/entando-k8s-keycloak-controller-0.0.0-SNAPSHOT-PR-24-1-tests.jar
[INFO] 
[INFO] --- maven-javadoc-plugin:3.2.0:jar (attach-javadocs) @ entando-k8s-keycloak-controller ---
[INFO] No previous run data found, generating javadoc.
[INFO] Building jar: /workspace/source/target/entando-k8s-keycloak-controller-0.0.0-SNAPSHOT-PR-24-1-javadoc.jar
[INFO] 
[INFO] --- license-maven-plugin:2.0.0:aggregate-download-licenses (download-licenses) @ entando-k8s-keycloak-controller ---
[INFO] skip flag is on, will skip goal.
[INFO] 
[INFO] --- quarkus-maven-plugin:1.2.0.Final:build (default) @ entando-k8s-keycloak-controller ---
[WARNING] [io.quarkus.creator.curator.Curator] These dependencies are not recommended:
	- javax.servlet:javax.servlet-api should be replaced by jakarta.servlet:jakarta.servlet-api
You might end up with two different versions of the same classes or with an artifact you shouldn't have in your classpath.
[INFO] [org.jboss.threads] JBoss Threads version 3.0.0.Final
[WARNING] [io.quarkus.deployment.steps.ReflectiveHierarchyStep] Unable to properly register the hierarchy of the following classes for reflection as they are not in the Jandex index:
	- org.entando.kubernetes.model.EntandoCustomResourceStatus
Consider adding them to the index either by creating a Jandex index for your dependency via the Maven plugin, an empty META-INF/beans.xml or quarkus.index-dependency properties.");.
[INFO] [io.quarkus.deployment.pkg.steps.JarResultBuildStep] Building thin jar: /workspace/source/target/entando-k8s-keycloak-controller-0.0.0-SNAPSHOT-PR-24-1-runner.jar
[INFO] [io.quarkus.deployment.QuarkusAugmentor] Quarkus augmentation completed in 1672ms
[INFO] 
[INFO] --- maven-surefire-report-plugin:3.0.0-M4:failsafe-report-only (integration-tests) @ entando-k8s-keycloak-controller ---
[INFO] 
[INFO] --- dependency-check-maven:6.0.3:aggregate (default) @ entando-k8s-keycloak-controller ---
[INFO] Checking for updates
[INFO] Skipping NVD check since last check was within 4 hours.
[INFO] Check for updates complete (93 ms)
[INFO] 

Dependency-Check is an open source tool performing a best effort analysis of 3rd party dependencies; false positives and false negatives may exist in the analysis performed by the tool. Use of the tool and the reporting provided constitutes acceptance for use in an AS IS condition, and there are NO warranties, implied or otherwise, with regard to the analysis or its use. Any use of the tool and the reporting provided is at the user’s risk. In no event shall the copyright holder or OWASP be held liable for any damages whatsoever arising out of or in connection with the use of this tool, the analysis performed, or the resulting report.


[INFO] Analysis Started
[INFO] Finished Archive Analyzer (0 seconds)
[INFO] Finished File Name Analyzer (0 seconds)
[INFO] Finished Jar Analyzer (0 seconds)
[INFO] Finished Dependency Merging Analyzer (0 seconds)
[INFO] Finished Version Filter Analyzer (0 seconds)
[INFO] Finished Hint Analyzer (0 seconds)
[INFO] Created CPE Index (2 seconds)
[INFO] Finished CPE Analyzer (4 seconds)
[INFO] Finished False Positive Analyzer (0 seconds)
[INFO] Finished NVD CVE Analyzer (0 seconds)
[INFO] Finished Sonatype OSS Index Analyzer (1 seconds)
[INFO] Finished Vulnerability Suppression Analyzer (0 seconds)
[INFO] Finished Dependency Bundling Analyzer (0 seconds)
[INFO] Analysis Complete (8 seconds)
[INFO] 
[INFO] --- jacoco-maven-plugin:0.8.5:report (report) @ entando-k8s-keycloak-controller ---
[INFO] Loading e**cution data file /workspace/source/target/jacoco.e**c
[INFO] Analyzed bundle 'Entando K8S Controller for Keycloak' with 5 classes
[INFO] 
[INFO] --- maven-surefire-report-plugin:3.0.0-M4:report-only (unit-tests) @ entando-k8s-keycloak-controller ---
[WARNING] Unable to locate Test Source XRef to link to - DISABLED
[INFO] 
[INFO] --- maven-install-plugin:2.4:install (default-install) @ entando-k8s-keycloak-controller ---
[INFO] Installing /workspace/source/target/entando-k8s-keycloak-controller-0.0.0-SNAPSHOT-PR-24-1.jar to /home/jenkins/.mvnrepository/org/entando/entando-k8s-keycloak-controller/0.0.0-SNAPSHOT-PR-24-1/entando-k8s-keycloak-controller-0.0.0-SNAPSHOT-PR-24-1.jar
[INFO] Installing /workspace/source/pom.xml to /home/jenkins/.mvnrepository/org/entando/entando-k8s-keycloak-controller/0.0.0-SNAPSHOT-PR-24-1/entando-k8s-keycloak-controller-0.0.0-SNAPSHOT-PR-24-1.pom
[INFO] Installing /workspace/source/target/entando-k8s-keycloak-controller-0.0.0-SNAPSHOT-PR-24-1-tests.jar to /home/jenkins/.mvnrepository/org/entando/entando-k8s-keycloak-controller/0.0.0-SNAPSHOT-PR-24-1/entando-k8s-keycloak-controller-0.0.0-SNAPSHOT-PR-24-1-tests.jar
[INFO] Installing /workspace/source/target/entando-k8s-keycloak-controller-0.0.0-SNAPSHOT-PR-24-1-javadoc.jar to /home/jenkins/.mvnrepository/org/entando/entando-k8s-keycloak-controller/0.0.0-SNAPSHOT-PR-24-1/entando-k8s-keycloak-controller-0.0.0-SNAPSHOT-PR-24-1-javadoc.jar
[INFO] 
[INFO] --- maven-deploy-plugin:2.8.2:deploy (default-deploy) @ entando-k8s-keycloak-controller ---
[INFO] Using alternate deployment repository local-nexus::default::http://nexus/repository/maven-releases/
[INFO] 
[INFO] ------------< org.entando:entando-k8s-keycloak-controller >-------------
[INFO] Building Entando K8S Controller for Keycloak 0.0.0-SNAPSHOT-PR-24-1
[INFO] --------------------------------[ jar ]---------------------------------
[INFO] 
[INFO] --- sonar-maven-plugin:3.8.0.2131:sonar (default-cli) @ entando-k8s-keycloak-controller ---
[INFO] User cache: /****/.sonar/cache
[INFO] SonarQube version: 8.5.0
[INFO] Default locale: "en_US", source code encoding: "UTF-8"
[INFO] Load global settings
[INFO] Load global settings (done) | time=215ms
[INFO] Server id: 1BD809FA-AWHW8ct9-T_TB3XqouNu
[INFO] User cache: /****/.sonar/cache
[INFO] Load/download plugins
[INFO] Load plugins index
[INFO] Load plugins index (done) | time=69ms
[INFO] Load/download plugins (done) | time=21851ms
[INFO] Loaded core extensions: developer-scanner
[INFO] JavaScript/TypeScript frontend is enabled
[INFO] Load project settings for component key: 'entando-k8s_entando-k8s-keycloak-controller'
[INFO] Load project settings for component key: 'entando-k8s_entando-k8s-keycloak-controller' (done) | time=61ms
[INFO] Process project properties
[INFO] E**cute project builders
[INFO] E**cute project builders (done) | time=2ms
[INFO] Project key: entando-k8s_entando-k8s-keycloak-controller
[INFO] Base dir: /workspace/source
[INFO] Working dir: /workspace/source/target/sonar
[INFO] Load project branches
[INFO] Load project branches (done) | time=32ms
[INFO] Check ALM binding of project 'entando-k8s_entando-k8s-keycloak-controller'
[INFO] Detected project binding: BOUND
[INFO] Check ALM binding of project 'entando-k8s_entando-k8s-keycloak-controller' (done) | time=24ms
[INFO] Load project pull requests
[INFO] Load project pull requests (done) | time=46ms
[INFO] Load branch configuration
[INFO] Load branch configuration (done) | time=477ms
[INFO] Load quality profiles
[INFO] Load quality profiles (done) | time=66ms
[INFO] Load active rules
[INFO] Load active rules (done) | time=1254ms
[INFO] Organization key: entando-k8s
[INFO] Pull request 24 for merge into master from ENG-1876_mounting_ca_secret_directly
[INFO] SCM collecting changed files in the branch
[WARNING] Exception caught during e**cution of command '[/usr/local/git/bin/git, config, --******, --edit]' in '/usr/local/git/bin', return code '128', error message 'fatal: Invalid path '/usr/local/git/etc': No such file or directory
'
[INFO] SCM collecting changed files in the branch (done) | time=327ms
[INFO] Indexing files...
[INFO] Project configuration:
[INFO] 13 files inde**d
[INFO] 0 files ignored because of scm ignore settings
[INFO] Quality profile for java: Sonar way
[INFO] Quality profile for xml: Sonar way
[INFO] ------------- Run sensors on module Entando K8S Controller for Keycloak
[INFO] JavaScript/TypeScript frontend is enabled
[INFO] Load metrics repository
[INFO] Load metrics repository (done) | time=26ms
[INFO] Sensor JavaSquidSensor [java]
[INFO] Configured Java source version (sonar.java.source): 8
[INFO] JavaClasspath initialization
[INFO] JavaClasspath initialization (done) | time=21ms
[INFO] JavaTestClasspath initialization
[INFO] JavaTestClasspath initialization (done) | time=2ms
[INFO] Java Main Files AST scan
[INFO] 5 source files to be analyzed
[INFO] 5/5 source files have been analyzed
[INFO] Java Main Files AST scan (done) | time=3996ms
[INFO] Java Test Files AST scan
[INFO] 7 source files to be analyzed
[INFO] Java Test Files AST scan (done) | time=1479ms
[INFO] 7/7 source files have been analyzed
[INFO] Java Generated Files AST scan
[INFO] 0 source files to be analyzed
[INFO] Java Generated Files AST scan (done) | time=1ms
[INFO] 0/0 source files have been analyzed
[INFO] Sensor JavaSquidSensor [java] (done) | time=5924ms
[INFO] Sensor SonarCSS Rules [cssfamily]
[INFO] No CSS, PHP, HTML or VueJS files are found in the project. CSS analysis is skipped.
[INFO] Sensor SonarCSS Rules [cssfamily] (done) | time=2ms
[INFO] Sensor C# Properties [csharp]
[INFO] Sensor C# Properties [csharp] (done) | time=2ms
[INFO] Sensor Import of Checkstyle issues [java]
[INFO] Importing /workspace/source/target/checkstyle-result.xml
[INFO] Sensor Import of Checkstyle issues [java] (done) | time=80ms
[INFO] Sensor SurefireSensor [java]
[INFO] parsing [/workspace/source/target/surefire-reports]
[INFO] Sensor SurefireSensor [java] (done) | time=48ms
[INFO] Sensor JavaXmlSensor [java]
[INFO] 1 source files to be analyzed
[INFO] Sensor JavaXmlSensor [java] (done) | time=232ms
[INFO] 1/1 source files have been analyzed
[INFO] Sensor HTML [web]
[INFO] Sensor HTML [web] (done) | time=5ms
[INFO] Sensor XML Sensor [xml]
[INFO] 1 source file to be analyzed
[INFO] 1/1 source file has been analyzed
[INFO] Sensor XML Sensor [xml] (done) | time=416ms
[INFO] Sensor VB.NET Properties [vbnet]
[INFO] Sensor VB.NET Properties [vbnet] (done) | time=2ms
[INFO] Sensor JaCoCo XML Report Importer [jacoco]
[INFO] Importing 1 report(s). Turn your logs in debug mode in order to see the exhaustive list.
[INFO] Sensor JaCoCo XML Report Importer [jacoco] (done) | time=121ms
[INFO] Sensor ThymeLeaf template sensor [securityjavafrontend]
[INFO] Sensor ThymeLeaf template sensor [securityjavafrontend] (done) | time=3ms
[INFO] Sensor JavaSecuritySensor [security]
[INFO] Reading type hierarchy from: /workspace/source/target/sonar/ucfg2/java
[INFO] Read 101 type definitions
[INFO] Reading UCFGs from: /workspace/source/target/sonar/ucfg2/java
[INFO] 07:54:05.835914 Building Runtime Type propagation graph
[INFO] 07:54:05.850772 Running Tarjan on 204 nodes
[INFO] 07:54:05.854963 Tarjan found 204 components
[INFO] 07:54:05.859771 Variable type analysis: done
[INFO] 07:54:05.864766 Building Runtime Type propagation graph
[INFO] 07:54:05.871805 Running Tarjan on 204 nodes
[INFO] 07:54:05.873108 Tarjan found 204 components
[INFO] 07:54:05.874328 Variable type analysis: done
[INFO] Analyzing 48 ucfgs to detect vulnerabilities.
[INFO] All rules entrypoints : 0 Retained UCFGs : 0
[INFO] rule: S5131, entrypoints: 0
[INFO] rule: S5131 done
[INFO] rule: S3649, entrypoints: 0
[INFO] rule: S3649 done
[INFO] rule: S2076, entrypoints: 0
[INFO] rule: S2076 done
[INFO] rule: S2091, entrypoints: 0
[INFO] rule: S2091 done
[INFO] rule: S2078, entrypoints: 0
[INFO] rule: S2078 done
[INFO] rule: S2631, entrypoints: 0
[INFO] rule: S2631 done
[INFO] rule: S5135, entrypoints: 0
[INFO] rule: S5135 done
[INFO] rule: S2083, entrypoints: 0
[INFO] rule: S2083 done
[INFO] rule: S5167, entrypoints: 0
[INFO] rule: S5167 done
[INFO] rule: S5144, entrypoints: 0
[INFO] rule: S5144 done
[INFO] rule: S5145, entrypoints: 0
[INFO] rule: S5145 done
[INFO] rule: S5146, entrypoints: 0
[INFO] rule: S5146 done
[INFO] rule: S5334, entrypoints: 0
[INFO] rule: S5334 done
[INFO] rule: S6096, entrypoints: 0
[INFO] rule: S6096 done
[INFO] Sensor JavaSecuritySensor [security] (done) | time=695ms
[INFO] Sensor CSharpSecuritySensor [security]
[INFO] Reading type hierarchy from: /workspace/source/target/ucfg_cs2
[INFO] Read 0 type definitions
[INFO] Reading UCFGs from: /workspace/source/target/ucfg_cs2
[INFO] No UCFGs have been included for analysis.
[INFO] Sensor CSharpSecuritySensor [security] (done) | time=1ms
[INFO] Sensor PhpSecuritySensor [security]
[INFO] Reading type hierarchy from: /workspace/source/target/sonar/ucfg2/php
[INFO] Read 0 type definitions
[INFO] Reading UCFGs from: /workspace/source/target/sonar/ucfg2/php
[INFO] No UCFGs have been included for analysis.
[INFO] Sensor PhpSecuritySensor [security] (done) | time=1ms
[INFO] Sensor PythonSecuritySensor [security]
[INFO] Reading type hierarchy from: /workspace/source/target/sonar/ucfg2/python
[INFO] Read 0 type definitions
[INFO] Reading UCFGs from: /workspace/source/target/sonar/ucfg2/python
[INFO] No UCFGs have been included for analysis.
[INFO] Sensor PythonSecuritySensor [security] (done) | time=0ms
[INFO] Sensor JsSecuritySensor [security]
[INFO] Reading type hierarchy from: /workspace/source/target/sonar/ucfg2/js
[INFO] Read 0 type definitions
[INFO] Reading UCFGs from: /workspace/source/target/sonar/ucfg2/js
[INFO] No UCFGs have been included for analysis.
[INFO] Sensor JsSecuritySensor [security] (done) | time=0ms
[INFO] ------------- Run sensors on project
[INFO] Sensor Zero Coverage Sensor
[INFO] Sensor Zero Coverage Sensor (done) | time=0ms
[INFO] Sensor Java CPD Block Inde**r
[INFO] Sensor Java CPD Block Inde**r (done) | time=49ms
[INFO] SCM Publisher SCM provider for this project is: git
[INFO] SCM Publisher 5 source files to be analyzed
[INFO] SCM Publisher 4/5 source files have been analyzed (done) | time=188ms
[WARNING] Missing blame information for the following files:
[WARNING]   * pom.xml
[WARNING] This may lead to missing/broken features in SonarCloud
[INFO] CPD E**cutor 1 file had no CPD blocks
[INFO] CPD E**cutor Calculating CPD for 4 files
[INFO] CPD E**cutor CPD calculation finished (done) | time=14ms
[INFO] SCM writing changed lines
[INFO] SCM writing changed lines (done) | time=78ms
[INFO] Analysis report generated in 237ms, dir size=295 KB
[INFO] Analysis report compressed in 35ms, zip size=76 KB
[INFO] Analysis report uploaded in 147ms
[INFO] ANALYSIS SUCCESSFUL, you can find the results at: https://sonarcloud.io/dashboard?id=entando-k8s_entando-k8s-keycloak-controller&pullRequest=24
[INFO] Note that you will be able to access the updated dashboard once the server has processed the submitted analysis report
[INFO] More about the report processing at https://sonarcloud.io/api/ce/task?id=AXf3FGy5YGfeNt47qruS
[INFO] Analysis total time: 13.811 s
[INFO] ------------------------------------------------------------------------
[INFO] BUILD SUCCESS
[INFO] ------------------------------------------------------------------------
[INFO] Total time:  01:38 min
[INFO] Finished at: 2021-03-03T07:54:07Z
[INFO] ------------------------------------------------------------------------
Picked up _JAVA_OPTIONS: -XX:+UnlockExperimentalVMOptions -Dsun.zip.disableMemoryMapping=**** -XX:+UseParallelGC -XX:MinHeapFreeRatio=5 -XX:MaxHeapFreeRatio=10 -XX:GCTimeRatio=4 -XX:AdaptiveSizePolicyWeight=90 -Xms1000m -Xmx12000m
[INFO] Scanning for projects...
[INFO] 
[INFO] ------------< org.entando:entando-k8s-keycloak-controller >-------------
[INFO] Building Entando K8S Controller for Keycloak 0.0.0-SNAPSHOT-PR-24-1
[INFO] --------------------------------[ jar ]---------------------------------
[INFO] 
[INFO] --- maven-site-plugin:3.9.0:site (default-site) @ entando-k8s-keycloak-controller ---
[INFO] configuring report plugin org.apache.maven.plugins:maven-project-info-reports-plugin:3.0.0
[INFO] 9 reports configured for maven-project-info-reports-plugin:3.0.0: dependency-info, distribution-management, index, ci-management, issue-management, licenses, plugins, scm, summary
[INFO] Rendering site with default locale English (en)
[WARNING] Unable to find a URL to the parent project. The parent menu will NOT be added.
[INFO] Relativizing decoration links with respect to localized project URL: https://central.entando.com
[INFO] Rendering content with org.apache.maven.skins:maven-default-skin:jar:1.3 skin.
[INFO] Generating "Dependency Information" report --- maven-project-info-reports-plugin:3.0.0:dependency-info
[INFO] Generating "About" report         --- maven-project-info-reports-plugin:3.0.0:index
[INFO] Generating "Issue Management" report --- maven-project-info-reports-plugin:3.0.0:issue-management
[INFO] Generating "Licenses" report      --- maven-project-info-reports-plugin:3.0.0:licenses
[INFO] Generating "Plugins" report       --- maven-project-info-reports-plugin:3.0.0:plugins
[INFO] Generating "Source Code Management" report --- maven-project-info-reports-plugin:3.0.0:scm
[INFO] Generating "Summary" report       --- maven-project-info-reports-plugin:3.0.0:summary
[INFO] ------------------------------------------------------------------------
[INFO] BUILD SUCCESS
[INFO] ------------------------------------------------------------------------
[INFO] Total time:  8.843 s
[INFO] Finished at: 2021-03-03T07:54:18Z
[INFO] ------------------------------------------------------------------------
error: etcdserver: request is too large
Congratulations! No build failures found for entando-k8s-keycloak-controller-PR-24.

Showing logs for build [32mentando-k8s-entando-k8s-keycloa-qj9bv-1[0m stage [32mfrom-build-pack[0m and container [32mstep-build-container-build[0m
Generating tags...
 - entando/entando-k8s-keycloak-controller -> docker.io/entando/entando-k8s-keycloak-controller:0.0.0-SNAPSHOT-PR-24-1
Checking cache...
 - entando/entando-k8s-keycloak-controller: Not found. Building
Building [entando/entando-k8s-keycloak-controller]...
Sending build context to Docker daemon  156.7kB
Step 1/7 : FROM entando/entando-k8s-operator-common:6.3.7
 ---> 85633026ebbe
Step 2/7 : ARG VERSION
 ---> Using cache
 ---> 597e7d1410af
Step 3/7 : LABEL name "Entando K8S Keycloak Controller" vendor "Entando" version "v${VERSION}" release "6" summary "This container processes EntandoKeycloakServer custom resources." description "This is a run-to-completion container. It will deploy a Keycloak or RedHat SSO server to your cluster                    Subsequent e**cutions of this container against the same EntandoKeycloakServer will patch the existing                    deployment resources"
 ---> Running in 8b66be3d6c6f
 ---> 64302e75b0e7
Step 4/7 : ENV JAVA_OPTIONS "-Djava.util.logging.manager=org.jboss.logmanager.LogManager"
 ---> Running in 25b33f763cbc
 ---> 81764c8a428b
Step 5/7 : ENV AB_ENABLED jmx_exporter
 ---> Running in 2cb99b41f031
 ---> dd79852f5fc5
Step 6/7 : COPY target/*-runner.jar /deployments/app.jar
 ---> 1f251ee8408d
Step 7/7 : ENTRYPOINT /deployments/run-java.sh
 ---> Running in 44a36f9a3324
 ---> 0acd0931b140
Successfully built 0acd0931b140
The push refers to a repository [docker.io/entando/entando-k8s-keycloak-controller]
e4b54e216831: Preparing
1863128980ff: Preparing
e811284c96e8: Preparing
523a9c2720f8: Preparing
088e643aafac: Preparing
00af10937683: Preparing
3aa55ff7bca1: Preparing
00af10937683: Waiting
3aa55ff7bca1: Waiting
088e643aafac: Layer already exists
00af10937683: Layer already exists
523a9c2720f8: Layer already exists
1863128980ff: Layer already exists
e811284c96e8: Layer already exists
3aa55ff7bca1: Layer already exists
e4b54e216831: Pushed
0.0.0-SNAPSHOT-PR-24-1: digest: sha256:bda0210ad1f6665a305dcf0d018a74a5a9504804b220b7fe7d1ffc9c29439011 size: 1791
There is a new version (1.20.0) of Skaffold available. Download it at https://storage.googleapis.com/skaffold/releases/latest/skaffold-linux-amd64


Showing logs for build [32mentando-k8s-entando-k8s-keycloa-qj9bv-1[0m stage [32mfrom-build-pack[0m and container [32mstep-postbuild-post-build[0m
no CVE provider running in the current ** namespace so skip adding image to be analysed

Showing logs for build [32mentando-k8s-entando-k8s-keycloa-qj9bv-1[0m stage [32mfrom-build-pack[0m and container [32mstep-promote-make-preview[0m
Creating /builder/home/.helm 
Creating /builder/home/.helm/repository 
Creating /builder/home/.helm/repository/cache 
Creating /builder/home/.helm/repository/local 
Creating /builder/home/.helm/plugins 
Creating /builder/home/.helm/starters 
Creating /builder/home/.helm/cache/archive 
Creating /builder/home/.helm/repository/repositories.yaml 
Adding stable repo with URL: https://charts.helm.sh/stable 
Adding local repo with URL: http://127.0.0.1:8879/charts 
$HELM_HOME has been configured at /builder/home/.helm.
Not installing Tiller due to 'client-only' flag having been set
sed -i -e "s/version:.*/version: 0.0.0-SNAPSHOT-PR-24-1/" Chart.yaml
sed -i -e "s/version:.*/version: 0.0.0-SNAPSHOT-PR-24-1/" ../*/Chart.yaml
sed -i -e "s|repository:.*|repository: docker.io\/entando\/entando-k8s-keycloak-controller|" values.yaml
sed -i -e "s/tag:.*/tag: 0.0.0-SNAPSHOT-PR-24-1/" values.yaml
echo "  version: 0.0.0-SNAPSHOT-PR-24-1" >> requirements.yaml
** step helm build
WARNING: No $CHART_REPOSITORY defined so using the default value of: http://jenkins-x-chartmuseum:8080
Adding missing Helm repo: storage.googleapis.com https://storage.googleapis.com/chartmuseum.jenkins-x.io
Successfully added Helm repository storage.googleapis.com.
Adding missing Helm repo: jenkins-x-chartmuseum http://jenkins-x-chartmuseum:8080
Successfully added Helm repository jenkins-x-chartmuseum.
WARNING: No $CHART_REPOSITORY defined so using the default value of: http://jenkins-x-chartmuseum:8080

Showing logs for build [32mentando-k8s-entando-k8s-keycloa-qj9bv-1[0m stage [32mfrom-build-pack[0m and container [32mstep-promote-jx-preview[0m
Creating a preview
Found commit author match for: ampie with email address: ampie.private@gmail.com
Created environment entando-k8s-keycloak-controller-kcpr24
Namespace entando-k8s-keycloak-controller-kcpr24 created 
expose:
  Annotations:
    helm.sh/hook: post-install,post-upgrade
    helm.sh/hook-delete-policy: hook-succeeded
  config:
    domain: *************
    exposer: Ingress
    http: "****"
preview:
  image:
    repository: docker.io/entando/entando-k8s-keycloak-controller
    tag: 0.0.0-SNAPSHOT-PR-24-1

WARNING: Could not find the service URL in namespace entando-k8s-keycloak-controller-kcpr24 for names : Timed out after 1m0s, last error: %!s(<nil>)
Updating PipelineActivities entando-k8s-entando-k8s-keycloak-controller-pr-24-1 which has status Running
WARNING: Failed to find the service entando-k8s-keycloak-controller : failed to find service entando-k8s-keycloak-controller in namespace entando-k8s-keycloak-controller-kcpr24: services "entando-k8s-keycloak-controller" not found

Showing logs for build [32mentando-k8s-entando-k8s-keycloa-qj9bv-1[0m stage [32mfrom-build-pack[0m and container [32mstep-promote-run-post-deployment-tests[0m
Picked up _JAVA_OPTIONS: -XX:+UnlockExperimentalVMOptions -Dsun.zip.disableMemoryMapping=**** -XX:+UseParallelGC -XX:MinHeapFreeRatio=5 -XX:MaxHeapFreeRatio=10 -XX:GCTimeRatio=4 -XX:AdaptiveSizePolicyWeight=90 -Xms1000m -Xmx12000m
[INFO] Scanning for projects...
[INFO] 
[INFO] ------------< org.entando:entando-k8s-keycloak-controller >-------------
[INFO] Building Entando K8S Controller for Keycloak 0.0.0-SNAPSHOT-PR-24-1
[INFO] --------------------------------[ jar ]---------------------------------
[INFO] 
[INFO] --- maven-resources-plugin:2.6:resources (default-resources) @ entando-k8s-keycloak-controller ---
[INFO] Using 'UTF-8' encoding to copy filtered resources.
[INFO] Copying 4 resources
[INFO] 
[INFO] --- maven-compiler-plugin:3.8.1:compile (default-compile) @ entando-k8s-keycloak-controller ---
[INFO] Nothing to compile - all classes are up to date
[INFO] 
[INFO] --- maven-resources-plugin:2.6:testResources (default-testResources) @ entando-k8s-keycloak-controller ---
[INFO] Using 'UTF-8' encoding to copy filtered resources.
[INFO] Copying 6 resources
[INFO] 
[INFO] --- maven-compiler-plugin:3.8.1:testCompile (default-testCompile) @ entando-k8s-keycloak-controller ---
[INFO] Nothing to compile - all classes are up to date
[INFO] 
[INFO] --- maven-surefire-plugin:3.0.0-M1:test (default-test) @ entando-k8s-keycloak-controller ---
[INFO] Tests are skipped.
[INFO] 
[INFO] --- maven-jar-plugin:3.2.0:jar (default-jar) @ entando-k8s-keycloak-controller ---
[INFO] 
[INFO] --- maven-jar-plugin:3.2.0:test-jar (build-test-jar) @ entando-k8s-keycloak-controller ---
[INFO] 
[INFO] --- maven-failsafe-plugin:3.0.0-M4:integration-test (run-tests) @ entando-k8s-keycloak-controller ---
[INFO] 
[INFO] -------------------------------------------------------
[INFO]  T E S T S
[INFO] -------------------------------------------------------
[INFO] Running org.entando.kubernetes.controller.keycloakserver.interprocesstests.AddEntandoKeycloakServerWithContainerizedDatabaseIT
Mar 03, 2021 7:56:38 AM org.entando.kubernetes.client.integrationtesthelpers.DeletionWaiter lambda$deleteSingleItem$2
WARNING: Deleting pods  entando-k8s-keycloak-controller-kcpr24/pg-test
Mar 03, 2021 7:56:38 AM org.entando.kubernetes.client.KubernetesRestInterceptor invoke
INFO: Entering method loadDockerImageInfoConfigMap in class org.entando.kubernetes.controller.support.client.EntandoResourceClient
Mar 03, 2021 7:56:38 AM org.entando.kubernetes.client.KubernetesRestInterceptor invoke
INFO: Exiting method loadDockerImageInfoConfigMap in class org.entando.kubernetes.controller.support.client.EntandoResourceClient
Mar 03, 2021 7:56:38 AM org.entando.kubernetes.client.KubernetesRestInterceptor invoke
INFO: Entering method loadDockerImageInfoConfigMap in class org.entando.kubernetes.controller.support.client.EntandoResourceClient
Mar 03, 2021 7:56:38 AM org.entando.kubernetes.client.KubernetesRestInterceptor invoke
INFO: Exiting method loadDockerImageInfoConfigMap in class org.entando.kubernetes.controller.support.client.EntandoResourceClient
!!!!!!!On EntandoKeycloakServer add!!!!!!!!!
Mar 03, 2021 7:56:39 AM org.entando.kubernetes.client.KubernetesRestInterceptor invoke
INFO: Entering method removeAndWait in class org.entando.kubernetes.controller.support.client.PodClient with entando-k8s-keycloak-controller-kcpr24,{EntandoKeycloakServer=test-keycloak-kcpr24, EntandoResourceNamespace=entando-k8s-keycloak-controller-kcpr24, EntandoResourceKind=EntandoKeycloakServer}
Mar 03, 2021 7:56:39 AM org.entando.kubernetes.client.KubernetesRestInterceptor invoke
INFO: Exiting method removeAndWait in class org.entando.kubernetes.controller.support.client.PodClient
Mar 03, 2021 7:56:39 AM org.entando.kubernetes.client.KubernetesRestInterceptor invoke
INFO: Entering method start in class org.entando.kubernetes.controller.support.client.PodClient with Pod: entando-k8s-keycloak-controller-kcpr24/test-keycloak-kcpr24-deployer-7586
Mar 03, 2021 7:56:39 AM org.entando.kubernetes.client.KubernetesRestInterceptor invoke
INFO: Exiting method start in class org.entando.kubernetes.controller.support.client.PodClient
[ERROR] Tests run: 2, Failures: 0, Errors: 2, Skipped: 0, Time elapsed: 49.978 s <<< FAILURE! - in org.entando.kubernetes.controller.keycloakserver.interprocesstests.AddEntandoKeycloakServerWithContainerizedDatabaseIT
[ERROR] org.entando.kubernetes.controller.keycloakserver.interprocesstests.AddEntandoKeycloakServerWithContainerizedDatabaseIT.create(EntandoOperatorComplianceMode)[1]  Time elapsed: 0.008 s  <<< ERROR!
java.lang.IllegalArgumentException: Too many items to create.
	at org.entando.kubernetes.controller.keycloakserver.interprocesstests.AddEntandoKeycloakServerWithContainerizedDatabaseIT.<init>(AddEntandoKeycloakServerWithContainerizedDatabaseIT.java:43)

[ERROR] org.entando.kubernetes.controller.keycloakserver.interprocesstests.AddEntandoKeycloakServerWithContainerizedDatabaseIT.create(EntandoOperatorComplianceMode)[2]  Time elapsed: 47.337 s  <<< ERROR!
org.awaitility.core.ConditionTimeoutException: Condition with lambda expression in org.entando.kubernetes.test.e2etest.helpers.E2ETestHelperBase was not fulfilled within 45 seconds.
	at org.entando.kubernetes.controller.keycloakserver.interprocesstests.AddEntandoKeycloakServerWithContainerizedDatabaseIT.create(AddEntandoKeycloakServerWithContainerizedDatabaseIT.java:69)

[INFO] Running org.entando.kubernetes.controller.keycloakserver.interprocesstests.AddEntandoKeycloakServerWithExternalPostgresqlDatabaseIT
Mar 03, 2021 7:57:24 AM org.entando.kubernetes.client.integrationtesthelpers.DeletionWaiter lambda$deleteSingleItem$2
WARNING: Deleting pods  entando-k8s-keycloak-controller-kcpr24/test-keycloak-kcpr24-deployer-7586
Mar 03, 2021 7:57:26 AM org.entando.kubernetes.client.integrationtesthelpers.DeletionWaiter lambda$deleteSingleItem$2
WARNING: Deleting pods  entando-k8s-keycloak-controller-kcpr24/pg-test
Mar 03, 2021 7:57:26 AM org.entando.kubernetes.client.KubernetesRestInterceptor invoke
INFO: Entering method loadDockerImageInfoConfigMap in class org.entando.kubernetes.controller.support.client.EntandoResourceClient
Mar 03, 2021 7:57:26 AM org.entando.kubernetes.client.KubernetesRestInterceptor invoke
INFO: Exiting method loadDockerImageInfoConfigMap in class org.entando.kubernetes.controller.support.client.EntandoResourceClient
Mar 03, 2021 7:57:26 AM org.entando.kubernetes.client.KubernetesRestInterceptor invoke
INFO: Entering method loadDockerImageInfoConfigMap in class org.entando.kubernetes.controller.support.client.EntandoResourceClient
Mar 03, 2021 7:57:26 AM org.entando.kubernetes.client.KubernetesRestInterceptor invoke
INFO: Exiting method loadDockerImageInfoConfigMap in class org.entando.kubernetes.controller.support.client.EntandoResourceClient
Mar 03, 2021 7:57:26 AM org.entando.kubernetes.client.integrationtesthelpers.DeletionWaiter lambda$deleteSingleItem$2
WARNING: Deleting pods  entando-k8s-keycloak-controller-kcpr24/pg-test
Mar 03, 2021 7:57:26 AM org.entando.kubernetes.client.integrationtesthelpers.DeletionWaiter lambda$deleteSingleItem$2
WARNING: Deleting entandodatabaseservices  entando-k8s-keycloak-controller-kcpr24/my-external-db-kcpr24
Mar 03, 2021 7:57:26 AM org.entando.kubernetes.client.integrationtesthelpers.DeletionWaiter lambda$deleteSingleItem$2
WARNING: Deleting secrets  entando-k8s-keycloak-controller-kcpr24/test-secret
ADDED:PodStatus(conditions=[PodCondition(lastProbeTime=null, lastTransitionTime=2021-03-03T07:57:26Z, message=null, reason=null, status=True, type=PodScheduled, additionalProperties={})], containerStatuses=[], ephemeralContainerStatuses=[], hostIP=null, initContainerStatuses=[], message=null, nominatedNodeName=null, phase=Pending, podIP=null, podIPs=[], qosClass=BestEffort, reason=null, startTime=null, additionalProperties={})
MODIFIED:PodStatus(conditions=[PodCondition(lastProbeTime=null, lastTransitionTime=2021-03-03T07:57:27Z, message=null, reason=null, status=True, type=Initialized, additionalProperties={}), PodCondition(lastProbeTime=null, lastTransitionTime=2021-03-03T07:57:27Z, message=containers with unready status: [pg-container], reason=ContainersNotReady, status=False, type=Ready, additionalProperties={}), PodCondition(lastProbeTime=null, lastTransitionTime=null, message=containers with unready status: [pg-container], reason=ContainersNotReady, status=False, type=ContainersReady, additionalProperties={}), PodCondition(lastProbeTime=null, lastTransitionTime=2021-03-03T07:57:26Z, message=null, reason=null, status=True, type=PodScheduled, additionalProperties={})], containerStatuses=[ContainerStatus(containerID=null, image=centos/********ql-96-centos7:latest, imageID=, lastState=ContainerState(running=null, terminated=null, waiting=null, additionalProperties={}), name=pg-container, ready=false, restartCount=0, started=null, state=ContainerState(running=null, terminated=null, waiting=ContainerStateWaiting(message=null, reason=ContainerCreating, additionalProperties={}), additionalProperties={}), additionalProperties={})], ephemeralContainerStatuses=[], hostIP=54.36.53.206, initContainerStatuses=[], message=null, nominatedNodeName=null, phase=Pending, podIP=null, podIPs=[], qosClass=BestEffort, reason=null, startTime=2021-03-03T07:57:27Z, additionalProperties={})
MODIFIED:PodStatus(conditions=[PodCondition(lastProbeTime=null, lastTransitionTime=2021-03-03T07:57:27Z, message=null, reason=null, status=True, type=Initialized, additionalProperties={}), PodCondition(lastProbeTime=null, lastTransitionTime=2021-03-03T07:57:27Z, message=containers with unready status: [pg-container], reason=ContainersNotReady, status=False, type=Ready, additionalProperties={}), PodCondition(lastProbeTime=null, lastTransitionTime=null, message=containers with unready status: [pg-container], reason=ContainersNotReady, status=False, type=ContainersReady, additionalProperties={}), PodCondition(lastProbeTime=null, lastTransitionTime=2021-03-03T07:57:26Z, message=null, reason=null, status=True, type=PodScheduled, additionalProperties={})], containerStatuses=[ContainerStatus(containerID=docker://9f8dbd87a16ece775c1e8f6ec717c774a792113d27decb5ed55e80bfb3debe61, image=docker.io/centos/********ql-96-centos7:latest, imageID=docker-pullable://docker.io/centos/********ql-96-centos7@sha256:b681d78125361519180a6ac05242c296f8906c11eab7e207b5ca9a89b6344392, lastState=ContainerState(running=null, terminated=null, waiting=null, additionalProperties={}), name=pg-container, ready=false, restartCount=0, started=null, state=ContainerState(running=ContainerStateRunning(startedAt=2021-03-03T07:57:32Z, additionalProperties={}), terminated=null, waiting=null, additionalProperties={}), additionalProperties={})], ephemeralContainerStatuses=[], hostIP=54.36.53.206, initContainerStatuses=[], message=null, nominatedNodeName=null, phase=Running, podIP=10.128.1.9, podIPs=[], qosClass=BestEffort, reason=null, startTime=2021-03-03T07:57:27Z, additionalProperties={})
MODIFIED:PodStatus(conditions=[PodCondition(lastProbeTime=null, lastTransitionTime=2021-03-03T07:57:27Z, message=null, reason=null, status=True, type=Initialized, additionalProperties={}), PodCondition(lastProbeTime=null, lastTransitionTime=2021-03-03T07:57:48Z, message=null, reason=null, status=True, type=Ready, additionalProperties={}), PodCondition(lastProbeTime=null, lastTransitionTime=null, message=null, reason=null, status=True, type=ContainersReady, additionalProperties={}), PodCondition(lastProbeTime=null, lastTransitionTime=2021-03-03T07:57:26Z, message=null, reason=null, status=True, type=PodScheduled, additionalProperties={})], containerStatuses=[ContainerStatus(containerID=docker://9f8dbd87a16ece775c1e8f6ec717c774a792113d27decb5ed55e80bfb3debe61, image=docker.io/centos/********ql-96-centos7:latest, imageID=docker-pullable://docker.io/centos/********ql-96-centos7@sha256:b681d78125361519180a6ac05242c296f8906c11eab7e207b5ca9a89b6344392, lastState=ContainerState(running=null, terminated=null, waiting=null, additionalProperties={}), name=pg-container, ready=****, restartCount=0, started=null, state=ContainerState(running=ContainerStateRunning(startedAt=2021-03-03T07:57:32Z, additionalProperties={}), terminated=null, waiting=null, additionalProperties={}), additionalProperties={})], ephemeralContainerStatuses=[], hostIP=54.36.53.206, initContainerStatuses=[], message=null, nominatedNodeName=null, phase=Running, podIP=10.128.1.9, podIPs=[], qosClass=BestEffort, reason=null, startTime=2021-03-03T07:57:27Z, additionalProperties={})
Finished: pg-test
Mar 03, 2021 7:57:49 AM org.entando.kubernetes.client.KubernetesRestInterceptor invoke
INFO: Entering method createOrReplaceService in class org.entando.kubernetes.controller.support.client.ServiceClient with EntandoDatabaseService: entando-k8s-keycloak-controller-kcpr24/my-external-db-kcpr24 and with Service: entando-k8s-keycloak-controller-kcpr24/my-external-db-kcpr24-db-service
Mar 03, 2021 7:57:49 AM org.entando.kubernetes.client.KubernetesRestInterceptor invoke
INFO: Exiting method createOrReplaceService in class org.entando.kubernetes.controller.support.client.ServiceClient
Mar 03, 2021 7:57:49 AM org.entando.kubernetes.client.KubernetesRestInterceptor invoke
INFO: Entering method createOrReplaceEndpoints in class org.entando.kubernetes.controller.support.client.ServiceClient with EntandoDatabaseService: entando-k8s-keycloak-controller-kcpr24/my-external-db-kcpr24 and with Endpoints: entando-k8s-keycloak-controller-kcpr24/my-external-db-kcpr24-db-service
Mar 03, 2021 7:57:49 AM org.entando.kubernetes.client.KubernetesRestInterceptor invoke
INFO: Exiting method createOrReplaceEndpoints in class org.entando.kubernetes.controller.support.client.ServiceClient
!!!!!!!On EntandoKeycloakServer add!!!!!!!!!
Mar 03, 2021 7:57:49 AM org.entando.kubernetes.client.KubernetesRestInterceptor invoke
INFO: Entering method removeAndWait in class org.entando.kubernetes.controller.support.client.PodClient with entando-k8s-keycloak-controller-kcpr24,{EntandoKeycloakServer=test-keycloak-kcpr24, EntandoResourceNamespace=entando-k8s-keycloak-controller-kcpr24, EntandoResourceKind=EntandoKeycloakServer}
Mar 03, 2021 7:57:49 AM org.entando.kubernetes.client.KubernetesRestInterceptor invoke
INFO: Exiting method removeAndWait in class org.entando.kubernetes.controller.support.client.PodClient
Mar 03, 2021 7:57:49 AM org.entando.kubernetes.client.KubernetesRestInterceptor invoke
INFO: Entering method start in class org.entando.kubernetes.controller.support.client.PodClient with Pod: entando-k8s-keycloak-controller-kcpr24/test-keycloak-kcpr24-deployer-0257
Mar 03, 2021 7:57:49 AM org.entando.kubernetes.client.KubernetesRestInterceptor invoke
INFO: Exiting method start in class org.entando.kubernetes.controller.support.client.PodClient
[ERROR] Tests run: 1, Failures: 0, Errors: 1, Skipped: 0, Time elapsed: 70.675 s <<< FAILURE! - in org.entando.kubernetes.controller.keycloakserver.interprocesstests.AddEntandoKeycloakServerWithExternalPostgresqlDatabaseIT
[ERROR] org.entando.kubernetes.controller.keycloakserver.interprocesstests.AddEntandoKeycloakServerWithExternalPostgresqlDatabaseIT.create  Time elapsed: 70.25 s  <<< ERROR!
org.awaitility.core.ConditionTimeoutException: Condition with lambda expression in org.entando.kubernetes.test.e2etest.helpers.E2ETestHelperBase was not fulfilled within 45 seconds.
	at org.entando.kubernetes.controller.keycloakserver.interprocesstests.AddEntandoKeycloakServerWithExternalPostgresqlDatabaseIT.create(AddEntandoKeycloakServerWithExternalPostgresqlDatabaseIT.java:53)

[INFO] 
[INFO] Results:
[INFO] 
[ERROR] Errors: 
[ERROR]   AddEntandoKeycloakServerWithContainerizedDatabaseIT.<init>:43->AddEntandoKeycloakServerBaseIT.<init>:56 » IllegalArgument
[ERROR]   AddEntandoKeycloakServerWithContainerizedDatabaseIT.create:69 » ConditionTimeout
[ERROR]   AddEntandoKeycloakServerWithExternalPostgresqlDatabaseIT.create:53 » ConditionTimeout
[INFO] 
[ERROR] Tests run: 3, Failures: 0, Errors: 3, Skipped: 0
[INFO] 
[INFO] 
[INFO] --- maven-surefire-report-plugin:3.0.0-M4:failsafe-report-only (integration-tests) @ entando-k8s-keycloak-controller ---
[WARNING] Unable to locate Test Source XRef to link to - DISABLED
[INFO] 
[INFO] --- maven-surefire-report-plugin:3.0.0-M4:report-only (unit-tests) @ entando-k8s-keycloak-controller ---
[WARNING] Unable to locate Test Source XRef to link to - DISABLED
[INFO] 
[INFO] --- maven-failsafe-plugin:3.0.0-M4:verify (run-tests) @ entando-k8s-keycloak-controller ---
[ERROR] There are test failures.

Please refer to /workspace/source/target/failsafe-reports for the individual test results.
Please refer to dump files (if any exist) [date].dump, [date]-***Run[N].dump and [date].dumpstream.
[INFO] 
[INFO] --- maven-site-plugin:3.9.0:site (default-site) @ entando-k8s-keycloak-controller ---
[INFO] configuring report plugin org.apache.maven.plugins:maven-project-info-reports-plugin:3.0.0
[INFO] 9 reports configured for maven-project-info-reports-plugin:3.0.0: dependency-info, distribution-management, index, ci-management, issue-management, licenses, plugins, scm, summary
[INFO] Rendering site with default locale English (en)
[WARNING] Unable to find a URL to the parent project. The parent menu will NOT be added.
[INFO] Relativizing decoration links with respect to localized project URL: https://central.entando.com
[INFO] Rendering content with org.apache.maven.skins:maven-default-skin:jar:1.3 skin.
[INFO] Generating "Dependency Information" report --- maven-project-info-reports-plugin:3.0.0:dependency-info
[INFO] Generating "About" report         --- maven-project-info-reports-plugin:3.0.0:index
[INFO] Generating "Issue Management" report --- maven-project-info-reports-plugin:3.0.0:issue-management
[INFO] Generating "Licenses" report      --- maven-project-info-reports-plugin:3.0.0:licenses
[INFO] Generating "Plugins" report       --- maven-project-info-reports-plugin:3.0.0:plugins
[INFO] Generating "Source Code Management" report --- maven-project-info-reports-plugin:3.0.0:scm
[INFO] Generating "Summary" report       --- maven-project-info-reports-plugin:3.0.0:summary
[INFO] ------------------------------------------------------------------------
[INFO] BUILD SUCCESS
[INFO] ------------------------------------------------------------------------
[INFO] Total time:  02:11 min
[INFO] Finished at: 2021-03-03T07:58:39Z
[INFO] ------------------------------------------------------------------------
error: etcdserver: request is too large
Post-deployment tests failed for entando-k8s-keycloak-controller-PR-24.
[31m
Pipeline failed on stage 'from-build-pack' : container 'step-promote-run-post-deployment-tests'. The execution of the pipeline has stopped.[0m
